ENGLISH,PORTUGUÊS (BRASIL)
They cannot make it past this point!\! Hold with everything you've got!!,Eles não podem passar deste ponto!\! Aguentem firme com tudo que vocês têm!!
"\n[8], this battle is over.\! Staying is suicide.","\n[8], esta batalha acabou.\! Ficar aqui é suicídio."
"Right you are, Lysander...","Você tem razão, Lysander."
Come on... we have to evacuate everyone now!,Vamos... precisamos evacuar todos agora!
"...\| Do it, then.\! Take everyone you can get and get the hell out this place.\! Go anywhere but here.\! Diana...",...\| Então o faça.\! Leve todos que puder pegar e vá embora deste maldito lugar.\! Vá para qualquer outro lugar que não aqui.\! Diana...
"Take the Historium Magnus, get out of here and fight on.\! I don't care how, just make sure these scumbags pay for everything they've done.","Pegue a Historium Magnus, saia daqui e continue a lutar.\! Não me importa como, apenas certifique-se de que esses canalhas paguem por tudo o que fizeram."
"\n[8], you are not alone in this battle...\| Don't throw your life away!!","\n[8], você não está só nesta batalha...\| Não jogue sua vida fora!!"
"I'm the reason for everything.\! This entire war.\! I'm not leaving this point.\! I beg you, live on, and destroy Casamir, destroy the cultists...\! Go, get out of here!!","Sou o motivo de tudo.\! De toda esta guerra.\! Não irei embora daqui.\! Eu imploro, continue a viver... e destrua Casamir, destrua os adoradores...\! Vá, vá logo embora daqui!!"
"Zelos...\| Look at me now.\! Doing exactly what you'd do, ha ha ha!\! You want me, Casamir?!\! Come and get it.","Zelos...\| Olhe só para mim.\! Fazendo exatamente o que você faria. Ha, ha, ha!\! Você me quer, Casamir??\! Pois venha então."
