ENGLISH,PORTUGUÊS (BRASIL)
"\c[1]Betrayal.\! Prime Minister Casamir has \n[8] and Zelos taken alive, just before assassinating Empress Florina.\! Using his position, he blames the murder on the Donari Temple's meddling.",\c[1]Traição.\! O primeiro-ministro Casamir capturou \n[8] e Zelos com vida pouco antes de conseguirem assassinar a Imperatriz Florina.\! Usando sua posição ele culpa o assassinato à intromissão do Templo Donari.
"\c[1]Unimpeded by a sitting head of state, and newly bolstered by the victory over Antares, Casamir strengthens his position as Prime Minister for all Veridia.\! But neither the throne, nor the Empire's strongest noble houses, are under his control.","\c[1]Sem ser impedido por um chefe de estado em exercício e recentemente fortalecido pela vitória sobre Antares, Casamir fortalece sua posição como primeiro-ministro de toda Veridia.\! Mas nem o trono nem as casas nobres mais importantes do Império estão sob seu controle."
"\c[1]Before too long, the great Dukes of the Empire, Terenor of the Duchy of Rimorgue...","\c[1]Sem demora, os grandes duques do império, Terenor do Ducado de Rimorgue..."
\c[1]Lothair of the Duchy of Isanter...,\c[1]Lothair do Ducado de Isanter...
\c[1]And Jaromir of the Duchy of Embor...,\c[1]E Jaromir do Ducado de Embor...
"\c[1]...All issue public rebukes of one another, claiming the Empress's murder was a political plot to attempt to gain control of the Imperial throne.","\c[1]... Todos emitiram repreensões públicas uns aos outros, alegando que o assassinato da Imperatriz foi uma trama política para tentar ganhar controle do trono imperial."
"\c[1]Florina's uncle, Terenor, sends his army to his forward base at Fort Eureeka as a show of force.","\c[1]O tio de Florina, Terenor, enviou seu exército para frente da base no Forte Eureka, como demonstração de força."
"\c[1]The fate of \n[8] and Zelos remain a mystery.\! However, fortunes turn in \n[8]'s favor as an unlikely hero arrives just in time...","\c[1]O destino de \n[8] e de Zelos ainda permanece um mistério.\! No entanto, a sorte vira a favor de \n[8] quando um herói improvável chega a tempo..."
