ENGLISH,PORTUGUÊS (BRASIL)
"\c[1]Embor Palace throne room, headquarters of the Nephilim Army\c[0]","\c[1]Sala do trono do Palácio de Embor, sede do Exército Nephilim\c[0]"
"You lovelies found me at the shrine in pursuit of my divine weapon.\! You see, as the legend goes, the original Nephilim sealed away their weapons after defeating Zanatus, and spread them throughout the world.\! Then the Temple decided, like many things, to keep this a secret.\! No need to fuss - you're in for a treat. Heard about your little divine intervention on Mount Ptolomea. Well... you haven't yet tasted power!\! These weapons will unlock every bit of your potential.","Seus queridos me encontraram no santuário em busca da minha arma divina.\! Sabe, como diz a lenda, os Nephilins originais selaram suas armas depois de derrotar Zanatus e as espalharam por todo o mundo.\! Então o Templo decidiu, como com muitas coisas, manter isso em segredo.\! Não precisa se preocupar... Você terá uma surpresa. Soube de sua pequena intervenção divina no Monte Ptolomea. Bom... você ainda não experimentou o poder!\! Essas armas abrirão todo o seu potencial."
"There's the magic of Cyrene, at Mount Karnac...",Tem a magia de Cyrene no Monte Karnac...
"Balmung, the divine greatsword of Ishtar, at Sandraka City...","Balmung, a grande espada divina de Ishtar, na cidade de Sandraka..."
"Valor, the gauntlet of Galzus at Greywind Peak, belonging to our Paladin of prolific proportions here...","Valor, a manopla de Galzus no Pico de Vendagris, pertencente à nossa Paladina de proporções prolíficas aqui..."
"Skyrender, underneath the royal Palace at Sayunaa.\! Oh, I suppose the heavens have chosen the poorly-dressed rogue to carry this torch, eh?\! Congratulations.","Celestra, sob o palácio real em Sayunaa.\! Ah, suponho que os céus escolheram o malandro mal-vestido para carregar esta tocha, né?\! Parabéns."
'Least I'm decently clothed...,"Pelo menos, minhas vestes são decentes..."
"Last and certainly not least, Lightfury, the sword of Donar, which dealt the final blow to Zanatus, piercing the demon's heart.\! Of course, this one's at the Imperial capital.\! We know this one belongs in your hands, \n[8].\! You holding Lightfury would be the closest any of us mere mortals can get to sitting down and having tea with Donar himself.","Por último e certamente não menos importante, Furiluz, a espada de Donar, que desferiu o golpe final em Zanatus, perfurando o coração do demônio.\! Claro, essa está na capital imperial.\! Sabemos que essa pertence às suas mãos, \n[8].\! Você segurar a Furiluz seria o mais próximo que qualquer um de nós, meros mortais, poderia chegar perto de sentar e tomar chá com o próprio Donar."
"Two are already found.\! Mine, and the Balmung, wielded by the black knight you darlings refer to as the Hand of Zanatus.\! But three are still ripe for the picking.","Duas já foram encontradas.\! A minha e a Balmung, empunhada pelo cavaleiro negro que vocês, queridos, chamam de Mão de Zanatus.\! Mas três ainda precisam ser coletadas."
