ENGLISH,PORTUGUÊS (BRASIL)
Raskuja... join me for a moment?,Raskuja... pode vir aqui rapidinho?
I will comply as the human requests.,Farei o que me é solicitado.
"Not an order, I just want to talk.\! I know so little about your people.\! What is your homeland like?","Não é uma ordem, só quero conversar.\! Sei tão pouco sobre o seu povo.\! Como é sua terra natal?"
"Barek Tor homeland is deep within what humans call island of Sinarra. Verrrrrrry far reaches of this world.\! Jungle outside is dangerous, filled with many aggrrrrrrrressive beasts.\! But when one reach Barek Tor villages, one reaches jungle paradise.\! Barek Tor grow jungle fruits that are desire arrrrrround world.\! Perhaps someday you taste.","A terra natal de Barek Tor fica nas profundezas do que humanos chamam de ilha de Sinarra. Fica bem nos confins deste mundo.\! A selva fora é perigosa, cheia de bestas agrrrrrressivas.\! Mas quando alguém chega aos vilarejos de Barek Tor, esse alguém chega ao paraíso da selva.\! Barek Tor cultiva frrrrrutas selvagens que são desejadas por todo o mundo.\! Quem sabe um dia experimentará."
That sounds amazing.\! Why in the world would one even leave?,Parece incrível.\! Por que então alguém sairia de lá?
"Barek Tor people struggle.\! Many years ago, human lands contact with us more.\! We trrrrrade goods, we mutual prosper.\! Barek Tor expand and grrrrrow population.\! But since recent years, isolation.\! Barek Tor no longer can support self completely.\! Our warrior class finding opportunity as mercenary, such as Raskuja.\! We buy what need from human lands to sustain Barek Tor people.\! Raskuja have many... as you say... nephew and niece. Need food, clothing.\! Raskuja's clan elevate him to high status in rrrrreturn for human money earned.","Povo de Barek Tor sofre.\! Muitos anos atrás, terras humanas fizeram mais contatos conosco.\! Trrrrrrocamos produtos. Prrrrosperamos igualmente.\! Barek Tor expandiu e crrrresceu a população.\! Mas, desde os anos mais recentes, isolamento.\! Barek Tor não pode mais se sustentar totalmente.\! Nossa classe guerreira encontrou oportunidade como mercenário, igual Raskuja.\! Compramos o que precisamos de terras humanas para sustentar povo de Barek Tor.\! Raskuja tem muitos... como vocês dizem... sobrinho e sobrinha. Precisa comida, roupa.\! Clã de Raskuja pode elevar Raskuja para alto status em trrrroca de dinheiro humano recebido."
I see.\| Taking care of little Barek Tor cubs. You are an honorable man... cat.\! Cat man?,Entendi.\| Tomar conta dos pequenos filhotes de Barek Tor. Você é um homem... gato honrável.\! Homem gato?
Raskuja is always happy to share. This conversation considered frrrrree of cost.,Raskuja fica feliz em compartilhar. Esta conversa considerada grrrrátis.
"Oh, well, what a relief.","Ah, que alívio."
