ENGLISH,PORTUGUÊS (BRASIL)
...Where is everyone else?!,... Onde está todo mundo??
Beatrix...,Beatrix...
This is not supposed to happen...,Isso não era para ter acontecido...
I should say so.,Eu que o diga.
"How about that.\! All four Nephilim, trapped... wherever this is, all by our lonesome.","Veja isso.\! Todos os quatro Nephilins presos... onde quer que seja, tudo por nossa solidão."
"Don't despair yet...\| There are several entry points in this tower.\! It is possible that the others are scattered in the area.\! Can't say for sure, darlings...",Não vamos nos desesperar ainda...\| Há vários pontos de entrada nesta torre.\! É possível que os outros estejam espalhados pela área.\! Não dá para dizer ao certo...
Seems we have no choice.\! Let's get on with it.,Parece que não temos escolha.\! Vamos continuar.
