ENGLISH,PORTUGUÊS (BRASIL)
"You're not leaving me yet, Zelos...","Você ainda não vai me deixar, Zelos..."
You've got Lightfury...,Você conseguiu a Furiluz...
Damn right I do.,Claro que consegui.
"Heh...\| I think you know what this means.\! The barrier between worlds is soon going to shatter, and Zanatus will return.\! What we saw today was just a small projection of the demon's power.",Hehe...\| Acho que você sabe o que isso significa.\! A barreira entre mundos logo será destruída e Zanatus retornará.\! O que vimos hoje era só uma pequena demonstração do poder do demônio.
"Then it seems we're going to have to kill Zanatus, huh?","Pelo visto, parece que remos que matar Zanatus, não é mesmo?"
"\n[8] and Zelos back together, trying to kill a god...\| I guess there are worse ways to die.","\n[8] e Zelos de volta juntos, tentando matar um deus...\| Acho que há formas piores de morrer."
"Is it true, what he said about the Nephilim?",É verdade. O que ele disse a respeito do Nephilim?
"If so, I suppose that would make me the fool for believing in fate.\! You'd like that, wouldn't you?","Se for assim, acho que entro para o clube dos tolos por acreditar em destino.\! Você gostaria disso, né?"
"A little bit, yeah...","Um pouco, sim..."
