ENGLISH,PORTUGUÊS (BRASIL)
The village of Eastwall...\| the people seem relieved to see us.,O vilarejo de Muralheste...\| as pessoas parecem aliviadas em nos ver.
The fighting has left their doorstep. Things can get back to normal.,A luta não mais está na porta deles. As coisas podem voltar ao normal.
"We have some time before our next mission.\! Eastwall will be our ""Home Base"" for now.\! We can trade with the locals, maybe recruit some of them into our force.\! I'll be at the blacksmith giving my gear a touch-up, catch you later.","Temos algum tempo até a nossa próxima missão.\! Muralheste será nossa “base principal” por agora.\! Podemos negociar com os locais e, quem sabe, recrutar alguns deles para a nossa força.\! Estarei no ferreiro dando um trato no meu equipamento. Nos falamos depois."
"Hey, \n[8]! Let me show you around.\! No need to rush, we can relax a bit now. We can talk and get caught up with each other!\! And as Zelos said, this is a chance for us to make improvements to our Squads and troops by trading with the locals.","Ei, \n[8]! Deixe-me mostrar o local.\! Sem pressa. Podemos relaxar um pouco agora. Podemos conversar e nos atualizar sobre nossas vidas!\! E, como Zelos disse, esta é uma chance para melhorarmos nossos esquadrões e nossas tropas ao comercializar com os locais."
"On the top is the Resource Bar.\! This shows how much Gold, Resources, and Tech Points we have.","No topo, fica a Barra de recursos.\! Ela mostra quanto de Ouro, Recursos e Tecnopontos temos."
"On the top right, we can see our Faction Rank, and progress toward the next rank.","No canto superior direito, podemos ver nosso Ranque da Facção e o progresso até o próximo ranque."
"On the left are all the things we can do at our Home Base.\! If you need me to walk you through these, click on the info icon and I'm happy to help!\! And, or, check out the Tutorials option. Don't be afraid to check this any time for helpful guides!","À esquerda estão todas as coisas que podemos fazer em nossa Base Principal.\! Se precisar que eu introduza a elas, clique no ícone de informações e prontamente ajudarei!\! Ou confira a opção Tutoriais. É possível consultar tudo a qualquer momento para obter guias úteis!"
"When you're all finished up with the Home Base, just ""Deploy"" to move on to the next chapter.","Quando tiver terminado na Base Principal, basta “Desdobrar” para avançar para o próximo capítulo."
