ENGLISH,PORTUGUÊS (BRASIL)
Legends 1A: Promise of Peace,Lendas 1A: Promessa de Paz
As expected. Lord Godfrey was never going to let this happen peacefully.,Como esperado. Lorde Godfrey jamais deixaria isso acontecer pacificamente.
"I must reach the capital, here. Be on guard, we can surely expect even more resistance than what we see now.\! Pray we do not face his elite Arbalest units again, they have proven quite deadly.",Preciso chegar à capital daqui. Fique em guarda. Certamente podemos esperar ainda mais resistência do que vimos até agora.\! Reze para que não enfrentemos suas unidades de elite de bestas. Elas se provaram bem mortais.
"Florina, I dread the idea of bringing a child to this battlefield. But you must know that these men are coming for you.\! You must stay near me, but stay safe. Just until we make it to Armitage in one piece.","Florina, temo a ideia de trazer uma criança para este campo de batalha. Mas precisa saber que esses homens estão vindo atrás de você.\! Você precisa ficar perto de mim, mas continuar a salvo. Só até chegarmos a Armitage inteiros."
"I will stay near! I trust you, Captain Antares!","Ficarei perto! Confio em você, Capitão Antares!"
Thank you. Donar watch over us.,Obrigado. Que Donar nos acompanhe.
"How absurd! This is the great hope for all Veridia? This small child?!\! What has she done to earn Donar's favor? What could she do?!\! Captain Antares, a true lapdog, to the very end. Arbalests, destroy him!","Absurdo! Essa é a grande esperança para toda Veridia? Essa criança mirrada?\! O que ela fez para ganhar a bênção de Donar? O que ela pode fazer?\! Capitão Antares, um verdadeiro cachorrinho de cabo a rabo. Unidade de bestas, destruam-no!"
