ENGLISH,PORTUGUÊS (BRASIL)
...Who are you?,... Quem é você?
"Your best friend today, nothing more, Razehl.","A melhor pessoa que você verá hoje, Razehl."
How do you know my name?,Como sabe meu nome?
"Take this dagger. You will need to fight your way out alongside us.\! Razehl, we know how they have treated you. These guards deserve to die.","Pegue esta adaga. Você precisará lutar para sair daqui conosco.\! Razehl, sabemos como eles o trataram. Esses guardas merecem morrer."
"No disagreement from you, I see.",Concordamos plenamente então.
"We will have to take advantage of this facility's lighting mechanism.\! Here, we can trigger this switch and turn off the light in a segment of these hallways.\! Without the light, we will have the freedom to cut down an unsuspecting enemy from the shadows.","Precisaremos usar o mecanismo de iluminação deste lugar a nosso favor.\! Aqui, podemos acionar este interruptor e desligar a luz em um segmento destes corredores.\! Sem a luz, teremos a liberdade para matar um inimigo desavisado atacando das sombras."
