ENGLISH,PORTUGUÊS (BRASIL)
"Hey there, Diana!\! Little Alex has just been wanderin' around lookin' for somethin' to keep him busy - I figured he'd...","Ei, Diana!\! O pequeno Alex está andando por aí procurando algo para se manter ocupado... Imaginei que ele..."
...Diana?\|\| Hey now... what gives?,... Diana?\|\| Ei... e aí?
You've taken quite a beatin'.\! 'N it's all been for the lot of us.\! Gettin' Alex back... but it still ain't enough I guess...,Você parece ter levado uma baita surra.\! Passamos por muitas coisas.\! Recuperar o Alex... mas acho que ainda não foi o suficiente...
I thought it would be better...,Achei que seria melhor...
We can only take so much.\! You're needin' rest my dear...\| Please sit this one out.\! You've done far more than your fair share...,"Nós conseguimos aguentar tanto.\! Você precisa descansar, meu bem...\| Por favor, sente-se.\! Você fez muito além do que precisava..."
I have been lent the blessing of Galzus. His might will not be wasted.,Recebi a bênção de Galzus. O poder dele não será desperdiçado.
"....\| Yeah, alright, I guess.",....\| É... certo.
Stefan...\| Alex has been through a lot and needs to be shown love.\! I cannot show it right now...,Stefan...\| Alex passou por muitas coisas e precisa receber um pouco de amor.\! Não consigo demonstrar amor agora...
...\| I hear ya. Don't worry 'bout it...,...\| Pode deixa. Não se preocupe...
