ENGLISH,ENGLISH
Chapter 5: Escape From Helios,Capítulo 5: Huida de Helios
"Tidereavers, the mark is hiding out at Granheim Abbey, and there's a mountain of gold waitin' to reward \n[27] bounty!\! I don't care if you burn the place to ashes... I want \n[8]'s pretty little blue head.","¡Cazamareas, el objetivo se oculta en la abadía de Granheim, y ofrecen una montaña de oro por \n[27] pellejo!\! No me importa si reducís este sitio a cenizas... Pero quiero la bonita cabeza azul de \n[8]."
"Oh my stars...\| Look, a baby dragon! What a sweet thing!","Ay, santo cielo...\| Mirad, ¡una dragoncito! ¡Qué cosita tan dulce!"
"""Sweet thing...""",«Cosita dulce...»
"Yes, it's scared, too...\| What are you doing here, dear dragon??","Sí, y además está asustado...\| ¿Qué haces aquí, querido dragón?"
"Tidereavers were probably lookin' to sell it. The grown ups go for a king's ransom, y'know.\! No surprise considerin' the devastation they can bring.","Probablemente los Cazamareas querían venderlo. Hay gente que paga el rescate de un rey por ellos cuando crecen, ¿sabes?\! Lo cual no es sorprendente, teniendo en cuenta lo devastadores que pueden llegar a ser."
Sister Diana... please allow me to care for this dragon.,"Hermana Diana..., deja que cuide de este dragón."
"Of course, Sister Abigayle. This dragon is a lucky one to have you.","Por supuesto, hermana Abigail. Ese dragón tiene suerte al haberte encontrado."
Oh my stars... that's quite a love bite!\! A little softer next time? Maybe I shall call you...\| Nibbler!,"Oh, cielos..., ¡eso si es que morder!\! ¿Menos fuerte la próxima vez? Tal vez deberíamos llamarte...\| ¡Mordiscos!"
