ENGLISH,ENGLISH
They cannot make it past this point!\! Hold with everything you've got!!,¡No deben rebasar este punto!\! ¡Aguantad con todas vuestras fuerzas!
"\n[8], this battle is over.\! Staying is suicide.","\n[8], esta batalla ha terminado.\! Quedarse aquí es un suicidio."
"Right you are, Lysander...","Tienes razón, Lysander..."
Come on... we have to evacuate everyone now!,"Vamos, ¡tenemos que evacuar a todo el mundo!"
"...\| Do it, then.\! Take everyone you can get and get the hell out this place.\! Go anywhere but here.\! Diana...","...\| Adelante.\! Reunid a todas las personas que podáis y largaos pitando de aquí.\! Id a cualquier parte, donde sea.\! Diana..."
"Take the Historium Magnus, get out of here and fight on.\! I don't care how, just make sure these scumbags pay for everything they've done.","Toma el Historium magnus, sal de aquí y sigue luchando.\! No me importa cómo lo hagas, pero asegúrate de que esa escoria pague por todo lo que ha hecho."
"\n[8], you are not alone in this battle...\| Don't throw your life away!!","\n[8], estamos juntos en esta batalla.\| ¡No desperdicies tu vida!"
"I'm the reason for everything.\! This entire war.\! I'm not leaving this point.\! I beg you, live on, and destroy Casamir, destroy the cultists...\! Go, get out of here!!","Yo soy la razón de todo.\! De toda esta guerra.\! No me marcharé de aquí.\! Os lo suplico, sobrevivid para destruir a Casamir y a los adeptos.\! Venga, ¡marchaos ya!"
"Zelos...\| Look at me now.\! Doing exactly what you'd do, ha ha ha!\! You want me, Casamir?!\! Come and get it.","Zelos...\| Mírame ahora.\! Estoy haciendo exactamente lo mismo que tú. ¡Ja, ja, ja!\! ¿Me quieres a mí, Casamir?\! Pues ven a buscarme."
