ENGLISH,ENGLISH
"\c[1]The old regime is gone.\! Unrest is put down by force, pretenders to the throne are defeated and executed, and the remnants of the Donari Temple are burned.","\c[1]El antiguo régimen ha desaparecido.\! Ahora, los disturbios se sofocan mediante el uso de la fuerza, los aspirantes al trono son ejecutados y los Templarios de Donar han quedado reducidos a cenizas."
"\c[1]Once a middling politician, Casamir has become the first Emperor of the Empire of Archaelus, and rules all humanity under its banner.","\c[1]Casamir, antaño un político de medio pelo, se ha convertido en el primer emperador del Imperio de Archaelus y en gobernador de toda la humanidad."
"\c[1]He has finally achieved his ultimate dream.\! But his grave injustices have gone unpunished, and few live on to spread the truth.",\c[1]Por fin ha logrado su sueño.\! Pero sus graves injusticias han quedado impunes y son pocos los que han logrado sobrevivir para contar la verdad.
"\c[1]The last of the Paladins lives on.\! Diana escaped the Siege of Fort Eureeka.\! Horrified that her son has gone missing, she gathered whoever she could find from the old army...","\c[1]La última de las paladinas sigue con vida.\! Diana logró escapar del asalto al fuerte Eureeka.\! Horrorizada por la desaparición de su hijo, reunió a todos los miembros que consiguió encontrar del antiguo ejército."
"\c[1]The Followers of Zanatus have occupied the highest roles in the Imperial government.\! Children are separated from families to become subjects of the cult.\! Worship of Donar, or belief in the legends of old, are now punishable by death.\! The world has returned to the dark times under the rule of Zanatus.",\c[1]Los Seguidores de Zanatus han ocupado los cargos superiores en el gobierno imperial.\! Los niños son separados de sus familias para convertirse en siervos del culto.\! Adorar a Donar o creer en las leyendas de antaño ahora se castiga con la muerte.\! El mundo ha regresado a la oscuridad que caracterizó el mandato de Zanatus.
"\c[1]Diana's resistance group fights on in \n[8]'s name.\! Focused on stopping child kidnappings, they break into one of the detention camps at Westerfield...","\c[1]El grupo de resistencia de Diana lucha en nombre de \n[8].\! Decididos a poner fin a los secuestros infantiles, irrumpen en uno de los centros de detención de Campoeste."
\c[1]                                   Two Years Pass.\|\|\|\^,\c[1]Dos años más tarde.\|\|\|\^
