ENGLISH,ENGLISH
Raskuja... join me for a moment?,"Raskuja, ¿puedes venir un momento?"
I will comply as the human requests.,Yo hacer lo que humano ordenar.
"Not an order, I just want to talk.\! I know so little about your people.\! What is your homeland like?","No es una orden, solo quiero hablar.\! No sé mucho sobre tu pueblo.\! ¿Cómo es tu tierra natal?"
"Barek Tor homeland is deep within what humans call island of Sinarra. Verrrrrrry far reaches of this world.\! Jungle outside is dangerous, filled with many aggrrrrrrrressive beasts.\! But when one reach Barek Tor villages, one reaches jungle paradise.\! Barek Tor grow jungle fruits that are desire arrrrrround world.\! Perhaps someday you taste.","Tierra natal Barek Tor estar en lo más prrrofundo de isla que los humanos llamar Sinarra. Muy lejos, en confines de este mundo.\! Selva ser muy peligrrrosa, llena de bestias agrrresivas.\! Pero cuando tú llegar a aldeas de Barek Tor, tú estar en paraíso.\! Barek Tor cultivar frrrutos de selva que desear todo el mundo.\! Quizá tú algún día prrrobar."
That sounds amazing.\! Why in the world would one even leave?,Suena genial.\! ¿Por qué querría alguien marcharse de un lugar así?
"Barek Tor people struggle.\! Many years ago, human lands contact with us more.\! We trrrrrade goods, we mutual prosper.\! Barek Tor expand and grrrrrow population.\! But since recent years, isolation.\! Barek Tor no longer can support self completely.\! Our warrior class finding opportunity as mercenary, such as Raskuja.\! We buy what need from human lands to sustain Barek Tor people.\! Raskuja have many... as you say... nephew and niece. Need food, clothing.\! Raskuja's clan elevate him to high status in rrrrreturn for human money earned.","Pueblo de Barek Tor sufrirrr.\! Muchos años atrrrás, tierras humanas contactar más con nosotros.\! Nosotrrros interrrcambiar bienes y prrrosperar todos.\! Barek Tor expandirrrse y población aumentar.\! Pero estos años, nosotrrros estar solos.\! Barek Tor ya no poder mantenerrrse del todo.\! Clase guerrera buscar oporrrtunidad como merrrcenarios, como hacer Raskuja.\! Nosotros comprrrar a tierras humanas cosas que necesitar para mantener pueblo de Barek Tor.\! Raskuja tener muchos, como vosotros decir, sobrrrinos y sobrrrinas. Ellos necesitar comida, ropa.\! Clan de Raskuja dar grrran estatus por ganar dinero humano."
I see.\| Taking care of little Barek Tor cubs. You are an honorable man... cat.\! Cat man?,Entiendo.\| Te ocupas de los cachorros de Barek Tor. Eres un hombre... gato honorable.\! ¿Hombrrre gato?
Raskuja is always happy to share. This conversation considered frrrrree of cost.,A Raskuja siemprrre gustar compartir. Esta converrrsación ser grrratis.
"Oh, well, what a relief.","Oh, vaya. Menos mal."
