ENGLISH,ENGLISH
"\c[1]Throne room, Imperial Palace\c[0]","\c[1]Sala del trono, palacio imperial\c[0]"
"Yes, yes, tell me what you have to say, cultist...","Venga, venga. Di lo que tengas que decir,"
"Sayunaa has broken the agreement and declared war.\! The Imperial legions of Isanter, Lemelin, and Westerfield are overwhelmed by rebellions and have pulled back to the heartlands.\! And \n[8]...","Sayunaa ha roto el acuerdo y ha declarado la guerra.\! Las legiones imperiales de Isanter, Lemelin y Campoeste se han visto superadas por las rebeliones y se han replegado a las tierras centrales.\! ¿Y \n[8]...?"
"\n[8] is DEAD!\! You may brainwash your masses of cultists, but you cannot fool me!"," ¡\n[8] ha muerto!\! Puedes lavarle el cerebro a tus hordas de adeptos, ¡pero no a mí!"
You told me this wouldn't happen...\| you told me my armies would be invincible...,Me dijiste que esto no pasaría...\| Me dijiste que mis ejércitos eran invencibles.
"We see that you've lost your mental capacities. Perhaps your sense of desperation has broken you.\! But we of the Followers of Zanatus are true to our word, and we will dispatch the False One for you.\! Remain in the capital until we tell you otherwise.","Parece que has perdido completamente la cabeza. Puede que tu desesperación haya podido contigo.\! Pero nosotros, los Seguidores de Zanatus, somos fieles a nuestra palabra y nos encargaremos de tu Hereje.\! Quédate en la capital hasta que te lo digamos."
"\n[8]...\| I hate you...\| I hope they stop \n[1]...\| please, someone, anyone stop \n[1]...","\n[8]...\| Te odio...\| Espero que detengan a \n[1]...\| Por favor, que alguien detenga a \n[1], quien sea."
