ENGLISH,ENGLISH
So what happened to your personal ambition?,¿Y qué fue de tu ambición personal?
"Beatrix, I gotta say.\! You're different.\! No more talk of ruling existence and building mile-high statues of yourself.","Beatrix, tengo que decírtelo.\! Eres diferente.\! Ya no hablas de regir toda existencia y de erigir estatuas gigantescas de tu persona."
"Hmmm, I suppose the idea became boring.\! I have moved on to... more immediate pursuits.","Mmm, supongo que la idea se volvió algo aburrida.\! Ahora persigo... objetivos más inmediatos."
Mind if I ask...\| Pendergast seemed a bit old to be your father.,Si me permites el comentario...\| Pendergast parecía algo mayor para ser tu padre.
"Well well, flattery will get you everywhere!\! If you must know, the old man adopted me.\! I always did have everything money could buy, save for true love and affection, of course!\! I've known for some time he simply wanted my divine gift.\! He would be pleased if I were to kill you now, and seek ultimate power for myself.\! But I can't let him have his way, hmm?\! Guess we found our answer, darling.\! No more power hungry Beatrix, because she doesn't want to be her father.","¡Vaya, vaya! ¡El que la sigue, con halagos la consigue!\! Si tanto te interesa, resulta que el abuelete me adoptó.\! Nunca me faltó de nada, a excepción, claro está, del afecto y el amor verdaderos.\! Hace tiempo supe que lo único que siempre deseó fue mi don divino.\! Le haría muy feliz que te matase aquí y ahora para poder alcanzar un poder supremo.\! Pero no puedo dejar que se salga con la suya, ¿verdad?\! Creo que ya tenemos la respuesta, cielo.\! Adiós a esa Beatrix sedienta de poder, pues no quiere convertirse en lo que es su padre."
Makes sense.,Tiene sentido.
"Oh, darling, one last thing.\! Have you thought about how you will be executing Lysander?\! May I suggest letting me use him for meteor target practice?","Cielo, una cosita más.\! ¿Has pensado en cómo vas a ejecutar a Lysander?\! Sugiero que me dejes usarlo como blanco durante las prácticas de lanzamiento de meteoritos."
"Uhhh... no.\! I'm still thinking about it.\! You joke about it, but... just give me some time.","Mmm, no.\! Todavía no me he decidido.\! Deja de hacer bromas con el tema... Solo necesito algo más de tiempo."
...Joke??,¿Cómo que bromas?
