ENGLISH,ENGLISH
"Hello, Jaromir. I'm glad you came to see me off.\| Still sticking to your plan?","Hola, Jaromir. Me alegra que hayas venido a despedirme.\| ¿Planeas seguir con tu plan?"
"...\| Yes.\| I must, Avatar of Donar.","...\| Sí.\| Debo haberlo, avatar de Donar."
"What the...\| call me \n[8], will ya?!","¿Eh?\| Mejor llámame \n[8], ¿quieres?"
"Of course, \n[8].","Claro, \n[8]."
"I hear you, there's a lot of work to be done. You're going to be integral to the rebuilding process in Veridia.","Está bien, tenemos mucho trabajo por delante. Tú serás una pieza clave para la reconstrucción de Veridia."
"It is not just that, \n[8].\| Since you appeared in our world, my holy covenant has not changed.\! The demonic cult brought undue burden to our homeland. These scars will not heal for some time.\! Adventuring off to the unexplored continent... that is a young one's game.\| But I can still be effective here... as a purveyor of Donar's goodness and glory.\! That some day, we will not need holy wars. Only an unshakeable faith in the true nature of all things to unify this world.","No es solo eso, \n[8].\| Desde que llegaste a nuestro mundo, mi compromiso sagrado no ha cambiado.\! El culto demoniaco trajo un caos extremo a nuestras tierras. Esas heridas tardarán un tiempo en curarse.\! Aventurarse hacia un continente sin explorar..., ese es el propósito de alguien joven.\| Pero yo aún puedo resultar de ayuda, ofreciendo la gracia y la gloria de Donar.\! Algún día, no necesitaremos guerras sagradas, solo nuestra fe inquebrantable en la verdadera naturaleza de las cosas, para unificar este mundo."
That's...\| that's a lot to put on your shoulders.,Esa es...\| una carga demasiado pesada para tus hombros.
"It is my reason to live.\| I live to be among Donar's greatest soldiers.\! And to protect the legacy of his Avatar, when she is finally ready to return to us.","Es mi razón para vivir.\| Vivo para estar entre los más grandes soldados de Donar.\! Y para proteger el legado de su avatar, cuando ella finalmente esté lista para regresar con nosotros."
"And return I will, Jaromir.\| Thank you for being by my side for this journey.\| I will see you again... but rest assured, Donar will be your partner in crime until then.","Ten por seguro que regresaré, Jaromir.\| Gracias por estar a mi lado en este viaje.\| Volvemos a vernos... Pero no temas, Donar será tu cómplice hasta entonces."
