ENGLISH,ENGLISH
"Well, here we are. Care to explain, Abi?","Bueno, aquí estamos. ¿Te importa explicarme de qué va esto, Abi?"
"I-I'm so sorry for bringing you here, \n[8]! Azuros has insisted that a battle of the utmost importance is going to take place here!","¡S-siento haberte traído aquí, \n[8]! Azuros ha insistido en que un combate de vital importancia tendrá lugar en este lugar."
"From the looks of it, he's not kidding...\| we've already attracted a lot of attention from the uh, locals.","Al parecer, no bromeaba...\| Ya hemos llamado demasiado la atención de los, eh, lugareños."
"\n[8], Azuros is prepared to speak with you...","\n[8], Azuros está preparado para hablar contigo."
\c[1]The one called Avatar of Donar listens now.,\c[1]El llamado avatar de Donar escucha ahora.
"Whoa... um,\| Yep, I'm all ears!","Ah..., eh...\| ¡Sí, soy todo oídos!"
"\c[1]Only two ears, this one has. Curious logic. Irrelevant.\! The enemies of the Avatar of Donar are a threat to my kin.\! Corrupted my brother, Kalytos the Red.\! This one's military will dispatch the enemy here. Then, to the Avatar of Donar, I impart the knowledge no longer known to you.","\c[1]Solo dos oídos, por lo que veo. Qué lógica tan extraña. No importa.\! Los enemigos del avatar de Donar son una amenaza para mi estirpe.\! Corrompieron a mi hermano, Kalytos el Rojo.\! Los militares de este se encargarán del enemigo aquí. Luego, avatar de Donar, te impartiré la sabiduría que no conoces."
"\n[8], they've got the eggs of three dragon brood mothers in their possession, and are seeking to control all dragons for the Imperial Army!","¡\n[8], tienen los huevos de 3 nidos de dragones en su haber y quieren controlar todos los dragones del Ejército Imperial!"
"Roger. We'll need to split our forces to cover all this ground. Sorry Casamir, no dragon eggs for you today.","Entendido. Tendremos que dividir a nuestros hombres para cubrir todo el terreno. Lo siento, Casamir. Hoy te quedas sin huevos de dragón."
