ENGLISH,ENGLISH
"What the...\| you ain't plannin' on leavin' by your lonesome, are ya?","¿Pero qué...?\| No pensarás marcharte por tu cuenta, ¿no?"
...\| I thought you said you missed your farm!\| What gives?!,...\| ¡Dijiste que echabas de menos tu granja!\| ¡¿Qué es lo que pasa ahora?!
"Yeah, I s'pose I said that, didn't I.\| Listen, I thought about it.\| You, goin off to some far off land, full'a danger 'n suspense, and me sittin' around takin' care of some horses.","Sí, supongo que lo dije, ¿no?\| Escucha, lo he estado pensando.\| Tú marchándote a tierras lejanas, llenas de peligros e incertidumbres, y yo aquí de brazos cruzados, tan solo al cuidado de unos caballos."
"When you put it that way, yeah, sounds like a real drag.\| So, you're coming to Grothnor with me, then?","Visto así, sí, parece un auténtico incordio.\| Entonces, ¿te vienes conmigo a Grothnor?"
Heck I don't even know what in tarnation Grothnor is!,"¡Demonios, ni siquiera sé qué rayos es Grothnor!"
It's...\| not a nice place. And that is the understatement of the century.\| Just giving you an out if you still wanna retire.,"Digamos que no es...\| un lugar muy agradable. Y decir eso es quedarse muy, pero que muy, muy corto.\| Así que ya tienes excusa por si prefieres no venir."
!!!\| The lip on this one! I ain't stayin' and that's final!,¡¿Cómo?!\| ¡Qué insolencia! ¡No me voy a quedar aquí y punto!
"Hahahah...\| alright, Barnabas. Back into the belly of the beast we go.\! Hope you're ready for the vacation of a lifetime...","Ja, ja, ja, ja...\| Está bien, Barnabas. De vuelta a la boca del lobo, pues.\! Espero que estés preparado para disfrutar de unas vacaciones inolvidables..."
