ENGLISH,ENGLISH
"Well fought out there, sir.\! Looks like I still have much to learn.","Bien luchado, señor.\! Parece que aún tengo mucho que aprender."
"Still callin' me ""Sir"" huh?\! Y'know that's no longer protocol, fancy boy.\! Technically yer above me in rank.","Sigues llamándome «señor», ¿eh?\! Sabes que ya no forma parte del protocolo, chico.\! Técnicamente, tienes un rango superior al mío."
Donar save us all.,Que Donar nos ampare.
Heh heh...,"Je, je, je."
How long have you been a Master Sergeant now?\! Just don't want to sully your name with an officer rank or what?,¿Cuánto llevas como sargento mayor?\! ¿Acaso no quieres manchar tu nombre con un rango de oficial o qué?
"Eh, come on now. Can one even imagine the likes 'a me sittin' down at the academy, face buried in books?\! I'd sooner take a spear through the gut, kid.\! Nah, I'm an enlisted man till the day I die.\! Just don't forget me when you're commandin' the whole army.","Eh, venga ya. ¿Te imaginas a alguien como yo sentado en la academia, hincando los codos?\! Antes preferiría clavarme una lanza en el estómago.\! Nah, soy un soldado raso y seguiré siéndolo hasta que me muera.\! Tan solo, procura no olvidarte de mí cuando dirijas todo el ejército."
"I could never, Barnabas.","Eso nunca, Barnabas."
