ENGLISH,ENGLISH
"Welcome to Ezrum, Jules.","Bienvenido a Ezrum, Jules."
"Yeah, wow! Narima... I have to admit, I didn't expect it to look like this.\! Everything looks kind of... new.\! The stories I've heard tell of ancient cities!","Sí, ¡guau! Narima... He de admitir que no me esperaba que fuera así.\! Todo parece tan... nuevo.\! ¡Las historias que escuché hablaban de ciudades antiguas!"
"Your perception serves you well.\! For this city is, for all purposes, only a generation older than we are.\! Its former, glorious form, dated back thousands of years...\! but the Veridians saw fit to destroy that which they could not have, to wipe an icon of the past off the timeline of this world.\! Well-dressed barbarians, they are.","Tu percepción no te engaña.\! Esta ciudad es, a todos los efectos, solo una generación más antigua que la nuestra.\! Su antiguo y glorioso aspecto se remontaba a miles de años,\! pero los veridianos decidieron destruir lo que no podían tener, borrar todo un emblema del pasado de la línea temporal de este mundo.\! No son más que bárbaros bien vestidos."
How did the Veridians cause so much destruction?,¿Cómo lograron los veridianos causar tanta destrucción?
"The Aetherium Crisis. You may hear tales of this event from the Veridians -\! that a Sayunaari princess named Soha of Dargon... whose beauty defied description, whose magical gift grew out of control... that she became a terrible archvillain.\! From the Sayunaari perspective, the conflict was provoked entirely by the Veridians, who made use of a power they could not understand, and did not deserve to wield.\! In a great war between the Empire of Veridia and all the world's nations, Ezrum was utterly destroyed by a nightmarish weapon they developed in a bid to subdue us.\! Tens of thousands of our people perished in an instant.\! Of course, even then, we Sayunaari perservered to win that war.\! Ezrum was rebuilt some 50 years ago, when the Aetherium Crisis's curse finally subided.","Mediante la Crisis de Etérium. Puede que los veridianos te hayan contado algo:\! que una princesa sayunaari llamada Soha de Dargon, cuya belleza resultaba indescriptible y cuyo talento mágico creció sin control... hasta acabar convertida en una horrible villana.\! Para los sayunaari, el conflicto fue obra de los veridianos, quienes usaron un poder que no podían comprender y no se merecían portar.\! En una gran guerra entre el Imperio de Veridia y el resto de naciones del mundo, Ezrum acabó totalmente destruida por una perversa arma que fue desarrollada con el fin de someternos.\! Decenas de miles de nuestra gente murieron en un instante.\! Obviamente, incluso entonces, los sayunaari perseveramos y logramos ganar la guerra.\! Ezrum se reconstruyó hace unos 50 años, cuando la maldición de la Crisis de Etérium desapareció al fin."
"Well that's an accomplishment, don't you think?","Todo una hazaña, ¿no crees?"
"Jules, this is something you must understand well.\! Our people do not value the same things Veridians do.\! While Ezrum now stands greater than its former self in many ways, a vital part of our national spirit was lost... forever.\! Ezrum as it should be stands only in memories that, too, will fade away in time.","Jules, esto es algo que debes entender.\! Nuestra gente no valor las mismas cosas que los veridianos.\! A pesar de que Ezrum es hoy en día más fuerte de lo que lo era en un pasado, una parte vital de nuestro espíritu nacional se perdió... para siempre.\! La verdadera Ezrum tan solo permanece en recuerdos que también se desvanecerán con el tiempo."
"Thank you, Narima. It seems I have much to learn about my homeland...","Gracias, Narima. Creo que tengo mucho que aprender sobre mi tierra..."
