ENGLISH,FRENCH
"...Okay, I'm certain I haven't touched drink today but I think I'm hallucinatin' already!","OK, j'ai même pas posé la main sur un verre de la journée, mais je crois que j'hallucine quand même."
"Welcome back, Diana.\! How do you feel?","C'est bon de te revoir, Diana.\! Comment te sens-tu ?"
Grateful to be home...\! H-how long has it been?,Ravie d'être de nouveau à la maison...\! Combien de temps cela fait-il ?
Only a few moments for us.,Seulement quelques moments pour nous.
"By Donar's will, the boon of Galzus has come to Tahnra...\| I only hope I am a worthy steward of this gift.","Par la volonté de Donar, la bénédiction de Galzus est venue en Tahnra...\| J'espère seulement en être digne."
Hell's bells. The Goddess of War just got even more... Goddessy.\! It just got reeeeeeal bad to be a bad guy.,Bon sang. La Déesse de la Guerre est devenue encore plus... Divine.\! C'est vraiiiiment pas le bon jour pour jouer les bad boys.
