ENGLISH,FRENCH
"\c[1]The False One's army is on the move.\! It seems they have punched above their weight... and I have serious doubts about Duke Terenor's abilities, if I may be critical.\! Beatrix, time for you to go to the battlefield and reinforce the Rimorgue Army.","\c[1]L'armée de l'Imposteur passe à l'offensive.\! Ils ont eu les yeux plus gros que le ventre... Et j'ai de sérieux doutes sur les capacités du Duc Terenor, si je puis me permettre.\!  Beatrix, il est temps pour toi de rejoindre le champ de bataille et de renforcer l'armée de Rimorgue."
"Not that I mind roasting entire armies alive, but tell me old man, why should I?","Non pas que ça me dérange de faire rôtir des armées entières, mais dis-moi, vieil homme, pourquoi le ferais-je ?"
"\c[1]You know why, my daughter.\! You are destined for untold greatness.\! People like us, we are meant to reshape this world as we see fit!\! For now, we have an opportunity to grind the nobles to dust before us.\! The war must rage on, and drain the blood of Veridia dry... yet again, haha!","\c[1]Tu sais pourquoi, ma fille.\! Tu es destinée à une grandeur incommensurable.\! Des gens comme nous, nous sommes destinés à remodeler ce monde comme nous l'entendons.\! Pour le moment, nous avons l'opportunité de réduire les nobles en poussière.\! La guerre doit faire rage et drainer tout le sang de Veridia... une nouvelle fois, ha ha !"
"Hmmm, alright, why not.\! You always did know how to sate my hunger for novelty, hah.","Hmmm, d'accord, pourquoi pas.\! Tu as toujours su comment assouvir ma soif de nouveauté, ah."
"\c[1]Just don't put yourself in unnecessary risk, Beatrix.\! This is not our fight, and I cannot bear to lose you now.","\c[1]Ne prends pas de risques inconsidérés, Beatrix.\! Ce n'est pas notre combat, je ne pourrai pas supporter de te perdre maintenant."
"Oh, relax.\! Just sit back and watch the barbecue.","Oh, du calme.\! Assieds-toi et regarde le barbecue."
