ENGLISH,FRENCH
Oxley...,Oxley...
My dear Diana...,Ma chère Diana...
"You were right...\| should have listened...\| end times are upon us...\| Nephilim, only hope...",Tu avais raison...\| J'aurais dû écouter...\| La fin des temps nous guette...\| les Nephilims... Notre dernier espoir.
Who did this?\! Who could destroy my Paladins and overcome the Temple?\! And what of my family?!,Qui a fait ça ?\! Qui a bien pu vaincre mes Paladins et le Temple ? Et qu'en est-il de ma famille ?
"Follow...\| the prophecy...\|\| You must take this key, to the Temple archives...\| forbidden pages of the book...",Accomplis...\| la prophétie...\|\| Prends cette clé des archives du Temple...\| les pages interdites...
"Make the pilgrimage, Diana...\| Back to where it all began...","Fais ton pèlerinage, Diana...\| Là où tout a commencé..."
Grandmaster...,Grand Maître...
"Come on, I need more!!\! Wake up!!",S'il vous plaît ! Je dois en savoir plus !!\! Réveillez-vous !
"...\| I will make this right, Grandmaster.\! Watch me from the heavens.\! I will see you there soon, victorious or not.",...\| Grand Maître... Comptez sur moi.\! Soyez-en témoin depuis les cieux.\! Nous nous y retrouverons victorieux !
