ENGLISH,FRENCH
Raskuja... join me for a moment?,Raskuja... tu as un instant ?
I will comply as the human requests.,Je me conforme à l'ordre de l'humain.
"Not an order, I just want to talk.\! I know so little about your people.\! What is your homeland like?","Ce n'est pas un ordre, j'ai juste envie de parler.\! J'en sais tellement peu sur ton peuple.\! C'est comment chez toi ?"
"Barek Tor homeland is deep within what humans call island of Sinarra. Verrrrrrry far reaches of this world.\! Jungle outside is dangerous, filled with many aggrrrrrrrressive beasts.\! But when one reach Barek Tor villages, one reaches jungle paradise.\! Barek Tor grow jungle fruits that are desire arrrrrround world.\! Perhaps someday you taste.","Le pays des Barek Tor est au plus profond de ce que les humains appellent Sinarra. Trrrrrès très loin.\! La jungle est dangereuse, pleines de bestioles agrrrrressives.\! Mais lorsqu'on arrive au village des Barek Tor, c'est un paradis dans la jungle.\! Les Barek Tor font pousser des frrrrruits de la jungle convoités partout.\! Peut-être qu'un jour tu y goûteras."
That sounds amazing.\! Why in the world would one even leave?,Ça l'air génial !\! Pourquoi es-tu donc parti ?
"Barek Tor people struggle.\! Many years ago, human lands contact with us more.\! We trrrrrade goods, we mutual prosper.\! Barek Tor expand and grrrrrow population.\! But since recent years, isolation.\! Barek Tor no longer can support self completely.\! Our warrior class finding opportunity as mercenary, such as Raskuja.\! We buy what need from human lands to sustain Barek Tor people.\! Raskuja have many... as you say... nephew and niece. Need food, clothing.\! Raskuja's clan elevate him to high status in rrrrreturn for human money earned.","Les Barek Tor traversent une époque difficile.\! Il y a quelques années, les humains sont rentrés plus souvent en contact.\! Nous avons échangé des biens, nous avons tous prrrrrospéré.\! La population des Barek Tor a grrrrrrrandi.\! Mais l'isolation se fait sentir depuis quelques années.\! Les Barek Tor ne peuvent plus subvenir à leurs propres besoins.\! Nos guerriers ont cherché à se rendre utiles ailleurs en tant que mercenaires, tout comme Raskuja.\! Nous achetons ce dont nous avons besoin chez les humains pour soutenir le peuple Barek Tor.\! Raskuja a beaucoup de... neveux et de nièces, comme les humains disent. Besoin de nourriture, vêtements...\! Le clan de Raskuja lui fera de nombreux honneurs en échange de l'arrrrrrgent des humains."
I see.\| Taking care of little Barek Tor cubs. You are an honorable man... cat.\! Cat man?,"Je vois.\| Tu prends soin des petits Barek Tor. Tu es un homme... enfin un chat honorable !\! Homme chat, peut-être ?"
Raskuja is always happy to share. This conversation considered frrrrree of cost.,Raskuja est toujours ravi de partager. Cette conversation ne te coûterrrrrrrrra pas un sou.
"Oh, well, what a relief.","Ah, ça me rassure."
