ENGLISH,FRENCH
"\c[1]Embor Palace throne room, headquarters of the Nephilim Army\c[0]","\c[1]Salle du trône du palais d'Embor, Quartier généraux de l'Armée des Nephilims\c[0]"
"You lovelies found me at the shrine in pursuit of my divine weapon.\! You see, as the legend goes, the original Nephilim sealed away their weapons after defeating Zanatus, and spread them throughout the world.\! Then the Temple decided, like many things, to keep this a secret.\! No need to fuss - you're in for a treat. Heard about your little divine intervention on Mount Ptolomea. Well... you haven't yet tasted power!\! These weapons will unlock every bit of your potential.","Vous êtes tombés sur moi pendant ma quête d'une arme divine.\! Voyez-vous, comme le dit la légende, les Nephilims originels ont scellé leurs armes après avoir vaincu Zanatus et les ont réparties dans le monde entier.\! Alors, le Temple a décidé, parmi d'autres choses, de garder cela secret.\! Vous allez vous régaler. J'ai entendu parler de votre petite intervention divine sur le Mont Ptolomée. Eh bien... Vous n'avez pas encore eu affaire au véritable pouvoir.\! Ces armes débloqueront vos pleins potentiels."
"There's the magic of Cyrene, at Mount Karnac...",La magie de Cyrene se trouve au Mont Karnac...
"Balmung, the divine greatsword of Ishtar, at Sandraka City...","Balmung, l'épée longue divine d'Ishtar est à Sandraka."
"Valor, the gauntlet of Galzus at Greywind Peak, belonging to our Paladin of prolific proportions here...","Valor, le gantelet de Galzus du Pic de Greywind, désormais en possession de notre Paladine aux proportions absurdes."
"Skyrender, underneath the royal Palace at Sayunaa.\! Oh, I suppose the heavens have chosen the poorly-dressed rogue to carry this torch, eh?\! Congratulations.","Cieleste est sous le palais royal de Sayunaa.\! Oh, je vois que les cieux ne sont pas très regardants sur l'habillage du porteur de ce flambeau.\! Félicitations."
'Least I'm decently clothed...,"Au moins, mes habits sont décents..."
"Last and certainly not least, Lightfury, the sword of Donar, which dealt the final blow to Zanatus, piercing the demon's heart.\! Of course, this one's at the Imperial capital.\! We know this one belongs in your hands, \n[8].\! You holding Lightfury would be the closest any of us mere mortals can get to sitting down and having tea with Donar himself.","Et enfin, Furie du Ciel, l'épée de Donar qui a porté le coup de grâce à Zanatus en lui transperçant le cœur.\! Bien évidemment, celle-là est à la capitale impériale.\! Nous savons que cette arme t'est destinée, \n[8].\! Si tu venais à mettre les mains sur Furie du Ciel, on serait tellement proche des Nephilims qu'on pourrait presque prendre le thé avec eux."
"Two are already found.\! Mine, and the Balmung, wielded by the black knight you darlings refer to as the Hand of Zanatus.\! But three are still ripe for the picking.","Nous en avons déjà trouvé deux.\! La mienne et Balmung, portée par le chevalier noir que vous appelez la Main de Zanatus.\! Mais il y en a encore trois prêtes à être trouvées."
