ENGLISH,FRENCH
"\c[1]The old regime is gone.\! Unrest is put down by force, pretenders to the throne are defeated and executed, and the remnants of the Donari Temple are burned.","\c[1]C'en est terminé du vieux régime.\! Les soulèvements sont réprimés par la force, les prétendants au trône sont arrêtés puis exécutés et les restes du Temple de Donar sont brûlés."
"\c[1]Once a middling politician, Casamir has become the first Emperor of the Empire of Archaelus, and rules all humanity under its banner.","\c[1]Casamir, auparavant un politicien ordinaire, est devenu le premier Empereur de l'Empire d'Archaelus et règne sur toute l'humanité d'une main de fer."
"\c[1]He has finally achieved his ultimate dream.\! But his grave injustices have gone unpunished, and few live on to spread the truth.",\c[1]Il a finalement obtenu ce dont il a toujours rêvé.\! Mais ses injustices sont restées impunies et peu sont ceux encore en vie pour en garder la mémoire.
"\c[1]The last of the Paladins lives on.\! Diana escaped the Siege of Fort Eureeka.\! Horrified that her son has gone missing, she gathered whoever she could find from the old army...","\c[1]Les derniers Paladins ont survécu.\! Diana est parvenue à s'échapper du siège de Fort Eureeka.\! Horrifiée d'apprendre la disparition de son fils, elle réunit des volontaires de l'ancienne armée..."
"\c[1]The Followers of Zanatus have occupied the highest roles in the Imperial government.\! Children are separated from families to become subjects of the cult.\! Worship of Donar, or belief in the legends of old, are now punishable by death.\! The world has returned to the dark times under the rule of Zanatus.",\c[1]Les Acolytes de Zanatus ont pris le contrôle des postes les plus haut-placés du gouvernement.\! Les enfants sont arrachés à leur famille pour devenir des disciples du culte.\! L'adoration de Donar ou les croyances en les légendes du passé sont maintenant punies de mort.\! Le monde est retourné aux temps obscurs sous le règne de Zanatus.
"\c[1]Diana's resistance group fights on in \n[8]'s name.\! Focused on stopping child kidnappings, they break into one of the detention camps at Westerfield...","\c[1]La résistance de Diana continue le combat au nom de \n[8].\! Déterminée à empêcher les enlèvements des enfants, son groupe s'infiltre dans un camp de prisonniers de Westerfield..."
\c[1]                                   Two Years Pass.\|\|\|\^,\c[1]                                   Deux années passèrent.\|\|\|\^
