ENGLISH,FRENCH
"What the...\| you ain't plannin' on leavin' by your lonesome, are ya?","Que... \| tu comptes pas partir et faire cavalier seul, si ?"
...\| I thought you said you missed your farm!\| What gives?!,...\| J'croyais que la ferme te manquait !\| Comment ça se fait ?
"Yeah, I s'pose I said that, didn't I.\| Listen, I thought about it.\| You, goin off to some far off land, full'a danger 'n suspense, and me sittin' around takin' care of some horses.","Ouais, j'ai p'têtre dit ça.\| Écoute, j'ai réfléchi.\| Tu vas t'aventurer dans un pays lointain truffé de dangers et de suspense, moi je stagne ici, à prendre soin des chevaux."
"When you put it that way, yeah, sounds like a real drag.\| So, you're coming to Grothnor with me, then?","Dis comme ça, ça ressemble à une corvée.\| Alors tu m'accompagnes à Grothonor ?"
Heck I don't even know what in tarnation Grothnor is!,"Bon sang, mais j'sais même pas ce que c'est, Grothonor !"
It's...\| not a nice place. And that is the understatement of the century.\| Just giving you an out if you still wanna retire.,"Ce... \| n'est pas un lieu accueillant. Et c'est le plus gros euphémisme du siècle.\| Je t'offre une porte de sortie, si t'as envie de renoncer."
!!!\| The lip on this one! I ain't stayin' and that's final!,"!!!\| Tais-toi ! J'reste pas, c'est mon dernier mot !"
"Hahahah...\| alright, Barnabas. Back into the belly of the beast we go.\! Hope you're ready for the vacation of a lifetime...",Ha ha ha... \| d'accord Barnabas. On retourne dans le ventre de la bête.\! J'espère que t'es prêt à vivre les vacances de ta vie...
