ENGLISH,FRENCH
Beatrix.\! A moment of your time?,Beatrix.\! Tu as un moment ?
"Oh my gracious, how rude of me.\! I should have sought you out should I wanted to prattle on about nonsense.\! Do forgive me.","Oh, quelle impolitesse de ma part.\! J'aurais dû te quérir moi-même si j'avais eu envie d'une conversation dénuée de sens.\! Pardonne-moi."
No prattle.\! I want to know what you're doing.\! Why you are here with us.,"Je ne suis pas là pour faire la conversation.\! Je veux savoir ce que tu fais.\! Pourquoi tu es ici, avec nous."
"This is why I do not trust the ""intellectual.""\! Too much education, not enough personality.\! You should make yourself useful and...\| disappear.","C'est pour ça que je ne fais pas confiance à « l'intellectuel ».\! Trop d'éducation, pas assez de personnalité.\! Tu devrais te rendre utile et...\| disparaître."
Everyone has their desires.\! What do you wish to gain?,Tout le monde a ses propres désirs.\! Quels sont les tiens ?
"Desires? Darling, I'm already at the top of the totem pole.\! On that subject, why are you still here?\! Admiring the view? Cannot say I blame you.","Mes désirs ? Mon chou, je suis déjà assise sur tout ce que je souhaite.\! À ce propos, pourquoi es-tu encore ici ?\! Tu admires la vue ? Je te comprends."
"Charming. It seems you're not going to take me seriously.\! Just know that I am not convinced by ""prophecy"" and will be watching your every move.",Charmant. Il semble que tu n'as pas l'intention de me prendre au sérieux.\! Sache juste que je ne me laisse pas convaincre par le mot « prophétie » et que je surveille chacun de tes mouvements.
Then what are you waiting for?\! All talk and no action makes Lysander a dull boy.,"Alors qu'est-ce que tu attends ?\! Tant de paroles pour si peu d'actions. Quel ennui, ce Lysandre."
"Hmph, you underestimate me, sorceress.\! So many have done so.\! But I have always found a way when others haven't.\! Goodbye, Beatrix.","Hmff. Tu me sous-estimes, magicienne.\! Tu n'es pas la première.\! Mais j'ai toujours trouvé le moyen d'arriver à mes fins là où les autres ont échoué.\! Au revoir, Beatrix."
