ENGLISH,FRENCH
"A hundred years of undue burden upon our people ends today.\! May the house of Dargon never be broken again... and may Donar be by your side, my love.","Cent ans de charges excessives sur notre peuple prennent fin aujourd'hui.\! Que la maison de Dargon ne soit plus jamais brisée... et que Donar soit à tes côtés, mon amour."
A hundred years of undue burden upon our people ends today.\! May the house of Dargon never be broken again.,Cent ans de charges excessives sur notre peuple prennent fin aujourd'hui.\! Que la maison de Dargon ne soit plus jamais brisée.
"Should anyone happen to threaten my little King Jules, well...\| you know.","Si quelqu'un devait menacer mon petit Roi Jules, eh bien...\| tu sais..."
"I'm so happy for you, Jules!","Je suis si heureuse pour toi, Jules !"
"Well, brother?\! Are you going to be comfortable as King, or must I usurp the throne myself?\! I am the official Princess-Royale, you know!","Eh bien, mon frère ?\! Vas-tu enfin prendre le rôle de Roi, ou dois-je usurper le trône moi-même ? \! Je suis la Princesse-Royale officielle, tu sais !"
You really mean it?,Tu le penses vraiment ?
"I am jesting, dear brother!\! Oh my stars, how dangerously naive!\! I implore you to depend on your followers, for there will be many who will wish you harm...","Je plaisante, cher frère!\! Oh mes étoiles, comme c'est dangereusement naïf !\! Je t'implore de compter sur tes partisans, car il y en aura beaucoup qui te voudront du mal..."
"I will, dear sister.","Je le ferai, chère sœur."
"\n[8], we had such a journey together...\| But our struggle has only just begun.\! Don't forget about me...","\n[8], nous avons fait un tel voyage ensemble...\| Mais notre lutte ne fait que commencer.\! Ne m'oubliez pas..."
