ENGLISH,FRENCH
Hey. I just wanted to thank you.,Salut. Je voulais juste te remercier.
For what?,Pour quoi ?
"You were my sole purpose for a long time.\! It really burned me up that you were just... out there somewhere, in their captivity.\! Thanks for giving me purpose.",Tu as longtemps été ma seule raison de vivre.\! Ça m'a vraiment fait beaucoup de mal de te savoir en captivité.\! Merci d'avoir donné un sens à ma vie.
"That's all you ever needed, \n[8].\! From that, everything else falls into place.\! Not everyone is like you, though.","C'est tout ce dont tu avais besoin, \n[8].\! À partir de là, le reste viendra naturellement.\! Mais tout le monde ne te ressemble pas."
"Yeah yeah, you always say that.\! But only you know what that really means.\! Only you in the world.","Oui, je sais, c'est ce que tu dis toujours.\! Mais il n'y a que toi qui sache ce que ça veut vraiment dire.\! Vraiment seulement toi."
"Zelos...\| next time, we rise and fall together.\! We're not going to be driven apart again.\! Not if I can help it...","Zelos...\| La prochaine fois, nous combattrons et nous tomberons ensemble.\! Plus jamais nous ne serons ainsi séparés.\! Pas tant que nous aurons notre mot à dire."
"...\| That would be good, \n[8].\! I've always looked out for you, why stop now, right?","...\| Ce serait parfait, \n[8].\! J'ai toujours gardé un œil sur tes arrières, pourquoi ça changerait ?"
"That, that'd be silly...",Ce serait idiot...
