ENGLISH,FRENCH
Chapter 13: Conquest,Chapitre 13 : Conquête
"Duke Terenor's son, Randolf, has taken over what remains of his father's army.\! Men of Veridia, clean up this rabble so we can get on with more important matters.","Le fils du duc Terenor, Randolf, a repris ce qui reste de l'armée de son père.\! Hommes de Veridia, exterminez cette populace pour que nous puissions nous occuper de choses plus importantes."
"Casamir. Men like you have no business in the game of war.\! We will show you how it works.\! Followers of Zanatus, we are to annihilate the enemy.","Casamir. Les hommes comme vous n'ont rien à faire dans le jeu de la guerre.\! Nous allons vous montrer comment ça marche. \! Serviteurs de Zanatus, nous devons anéantir l'ennemi."
"Your life is mine, Randolf.","Ta vie est mienne, Randolf."
You bloody bastard...\| to hell with you!,Espèce de salaud...\| Va au diable !
"Donari Temple. A concentration of lies.\! Show them no quarter. Strip this place of every icon, every text, every sign of life, and burn it to ashes.","Le Temple de Donar. Quel amas de mensonges.\! Ne leur faites pas de quartier. Dépouillez ce lieu de toute icône, de tout texte, de tout signe de vie, et réduisez-le en cendres."
