ENGLISH,ZH-cn
Beatrix.\! A moment of your time?,碧翠丝。\!可否占用一点你的时间？
"Oh my gracious, how rude of me.\! I should have sought you out should I wanted to prattle on about nonsense.\! Do forgive me.",噢天哪，我太粗鲁了。\!如果我想喋喋不休地胡说八道，我应该去找你。\!请原谅我。
No prattle.\! I want to know what you're doing.\! Why you are here with us.,废话少说。\!我想知道你在做什么。\!为什么要和我们一起行动。
"This is why I do not trust the ""intellectual.""\! Too much education, not enough personality.\! You should make yourself useful and...\| disappear.",这就是我不信任“知识分子”的原因。\!接受太多教育，没有什么个性。\!你应该让自己变得有用然后……\|消失。
Everyone has their desires.\! What do you wish to gain?,每个人都有自己的欲望。\!你想得到什么？
"Desires? Darling, I'm already at the top of the totem pole.\! On that subject, why are you still here?\! Admiring the view? Cannot say I blame you.",欲望？亲爱的，我已经站在了图腾柱的顶端。\!说到这个，你为什么还在这里？\!欣赏美景？这我倒是不能怪你。
"Charming. It seems you're not going to take me seriously.\! Just know that I am not convinced by ""prophecy"" and will be watching your every move.",适可而止。看来你不打算把我当回事。\!你只需要知道我不信服“预言”，而是会注视着你的一举一动。
Then what are you waiting for?\! All talk and no action makes Lysander a dull boy.,那你还在等什么？\!光说不做会让莱森德变成一个迟钝的孩子。
"Hmph, you underestimate me, sorceress.\! So many have done so.\! But I have always found a way when others haven't.\! Goodbye, Beatrix.",哼，你低估了我，女术士。\!很多人都犯过这个错误。\!但我总能找到其他人找不到的方法。\!再见，碧翠丝。
