ENGLISH,ZH-cn
"Well fought out there, sir.\! Looks like I still have much to learn.",大人，你打的很精彩。\!看来我还有很多要学。
"Still callin' me ""Sir"" huh?\! Y'know that's no longer protocol, fancy boy.\! Technically yer above me in rank.",怎么还叫我“大人”？\!小伙子，你知道这礼节已经不适用了。\!理论上来说，你的军衔已经比我高了。
Donar save us all.,愿多纳尔拯救我们……
Heh heh…,呵呵……
How long have you been a Master Sergeant now?\! Just don't want to sully your name with an officer rank or what?,你待在军士长这个职位上已经多久了？\!不想让军官衔位玷污你的名字？
"Eh, come on now. Can one even imagine the likes 'a me sittin' down at the academy, face buried in books?\! I'd sooner take a spear through the gut, kid.\! Nah, I'm an enlisted man till the day I die.\! Just don't forget me when you're commandin' the whole army.",呃，别笑话我了。你能想象我这样的人，在学院里正襟危坐地读书吗？\!年轻人，那我宁愿被长矛刺穿肠子。\!没这回事，我直到死，也是一名军人。\!当你做指挥官统领大军的时候，可别忘了我啊。
"I could never, Barnabas.",绝对不会的，巴纳巴斯。
