ENGLISH,KOREAN
"\c[1]The next Nephilim shrine lies within the royal palace at the capital of Sayunaa, the Kingdom of Gold.",\c[1]다음 네필림 사당은 황금의 왕국 사유나의 수도 궁전 안에 있다.
"\c[1]Sayunaa is an ancient land that grew into a vastly separate culture from the rest of humanity long ago.\! Their land is covered in deserts and high mountains, though its mines seem to spill forth with gold and jewels without end.","\c[1]사유나는 고대의 나라로 오래 전에 인류의 다른 문화권과는 아주 동떨어진 문화를 성장시켰다. \! 이들의 땅은 사막과 높은 산으로 덮여 있지만, 그 광산은 금과 보석을 끝없이 쏟아내는 것처럼 보인다."
"\c[1]Because of this wealth, the world has sought the riches of Sayunaa for centuries, and very few have been able to dent the staunch natural and human defenses that protect the region.\! But the might of the Imperial campaigns of conquest subdued the kingdom, forcing a military alliance.\! To preserve their culture, Sayunaa has become a tributary state to the Empire.","\c[1]이런 부 덕분에, 세상은 수 세기 동안 사유나의 부를 손에 넣고 싶어했고, 극소수만이 그 지역을 보호하는 견고한 자연과 사람들의 방어를 조금이라도 손상시킬 수 있었다. \! 하지만 제국의 정복 작전의 힘은 왕국을 제압했고, 군사 동맹을 강요했다. \! 자신들의 문화를 보존하기 위해 사유나는 제국의 속국이 되었다."
"\c[1]A war in Sayunaa would be a monumental challenge.\! Some of the mightiest Imperial armies are just a stone's throw to the west, at the Imperial stronghold of Stormrook.\! Do the Sayunaari people deserve to be subject to bloodshed?\! Or are they too far gone, too loyal to the enemy?","\c[1]사유나에서의 전쟁은 기념비적인 도전이 될 것이다. \! 가장 강력한 제국 군대 중 일부는 제국의 요새인 스톰루크에서 서쪽으로 지근 거리에 있다. \! 사유나 사람들이 유혈 사태의 대상이 되어야만 하는가? \! 아니면 그들이 선을 넘어, 적에게 너무 충성하는 것인가?"
"\c[1]On the cusp of a decision with great consequences, \n[8] weighs \n[27] options...","\c[1]중대한 결과를 초래하는 결정의 장에서, \n[8]는 \n[27]의 선택지를 두고 고민한다..."
