ENGLISH,KOREAN
"This is the Historium Magnus.\! It is an ancient text written by the founders of the Donari Temple, recalling the events of the original battle with Zanatus.",이건 히스토리움 마그누스에요. \! 도나리 교단의 창시자들이 자나투스와의 최초 전투에서 있었던 사건들을 회고하여 적은 고대 문서죠.
Looks like a bunch of gibberish to me...,내가 보기엔 그냥 말도 안되는 소리들 같은데...
"You and I will not be able to read it.\! Only the Temple Grandmasters, and one protege, have gone through the years of rigorous study required to interpret it.",당신과 나는 읽을 수 없을 거에요. \! 교단 대사제들과 한 명의 제자만이 그걸 해석하는 데 필요한 수년 간의 엄격한 연구를 거쳐 읽을 수 있죠.
"How nice of the founders to keep secrets from the rest of us, don't you think?","창시자들이 우리 나머지 사람들에게 비밀을 유지하다니 정말 친절하네요, 그렇지 않아요?"
"Grandmaster Oxley wishes for me to take the book.\! Leaving it here is too dangerous for the innocents who live here...\| you must tell no one, \n[8].\! The cult will do anything to gain the knowledge within these texts...","대사제 옥슬리 님은 제가 책을 가져가길 바랬어요. \! 여기에 이 책을 보관하는건 여기 사는 무고한 사람들에게 너무 위험하니까요... \| 그 누구에게도 말해선 안돼요, \n[8].\! 광신도들은 이 문서에 담긴 지식을 얻기 위해서는 무슨 짓이든 할 거에요..."
"Lastly, he has agreed to help finance our army, to the tune of 10,000 gold pieces.\! May we not squander this blessing.","마지막으로, 대사제님이 우리 군대의 자금 조달을 돕기로 동의했어요, 정확히는 금화 10,000개를 말이죠. \! 이 축복을 우리가 낭비하지 않기를."
