ENGLISH,KOREAN
"\c[1]Throne room, Imperial palace at the capital\c[0]","\c[1]알현실, 제국 수도의 황궁\c[0]"
"You gaze upon the throne as though you will never have it, Prime Minister.\! ...As if you actually need the Temple's permission.","절대로 가질 수 없는 것처럼 옥좌를 바라보는군, 수상.\! ...마치 정말로 교단의 허락이 필요한 것처럼."
"I could sit there at any moment.\! But I dare not...\! To you people, what this throne represents might seem like a trifling matter.\! But to me... it is my entire life.\! The Temple will confirm me, and then no one will question my rule.","난 언제라도 저기 앉을 수 있소. \! 하지만 감히 그러지 않는 거지. \! 당신들에게는 이 옥좌가 대표하는 것이 사소한 문제처럼 보일 수도 있소. \! 하지만 내게는... 이건 내 일생을 건 거요.\! 교단은 날 승인하게 될거고, 그러고 나면 누구도 내 통치에 의문을 제기하지 않겠지."
"As you wish, but short of that, we will find a way.\! We have word that the False One has reached Lemelin Monastery.\! The casus belli is now yours, you may make your next move.","당신이 원하는 대로 할 테지만, 만약 실패한다면 우리는 다른 방법을 찾을 거요. \! 그릇된 자가 레멜린 수도원에 도착했다는 소식이 있소. \! 전쟁 명분은 이제 수상 당신의 것이니, 다음 단계를 밟아도 될거요."
"Then the orphan and the Paladins will soon be utterly destroyed, and the Temple will fall in line.","그러면 그 고아와 성기사들은 곧 완전히 궤멸될 거고, 교단도 함께 무너지겠지."
"We have concern that you don't take the game of war seriously enough, Prime Minister.\! The Temple warriors have thwarted even us time and time again.\! You must bring overwhelming force, or you will lose.","수상이 전쟁의 역학을 숙고하지 않는다는 우려가 우리쪽에서 나오고 있소. \! 교단 전사들은 우리조차도 몇 번이나 좌절시켰지. \! 압도적인 힘을 퍼부어야지, 그렇지 않으면 당신은 패배할 거요."
"What are you worried about, anyway?\! General Lysander, one of our best tacticians, will command the army.\! We will bring our gunner squads to bear as well.\! And now, I've had just about enough of justifying myself to you people. Off with you!","대체 뭐 그리 걱정이 많은거요? \! 우리 최고 전술가 중 한 명인 라이샌더 장군이 군대를 지휘할 텐데. \! 우리의 화기 부대도 투입할 예정이오. \! 이제 슬슬, 당신들에게 내 일거수일투족을 설명하는 것도 충분히 한 것 같군. 이만 가보시게!"
"Best of luck in the coming battle, Prime Minister.","그럼 다가올 전투에서 무운을 비오, 수상."
