ENGLISH,KOREAN
"\c[1]\n[8] leads \n[27] army into the heart of enemy territory, and seizes Fort Eureeka.",\c[1]\n[8]의 군대는 적진의 심장부로 들어가 유리카 요새를 점령한다.
"\c[1]This victory shocks the world.\! Duke Terenor, who expected to win this war easily, now finds a powerful enemy force within a stone's throw of their capital at Rimorgue.",\c[1]이 승리는 세상을 충격에 빠뜨린다. \! 이 전쟁에서 손쉬운 승리를 기대했던 테레노어 공작은 이제 리모르그 수도의 지척에 있는 강력한 적군을 마주한다.
"\c[1]Duke Terenor hears many pleas for a cease fire, but seeing scores of slain countrymen at the hands of the Western Army, his heart is consumed with hatred and a desire for revenge.\! Terenor decides to gather the remainder of his army to personally command a counter-attack on Fort Eureeka as the age of nobles teeters on the brink...","\c[1]테레노어 공작은 휴전에 대한 많은 간청을 듣지만, 서부군의 손에 죽임을 당한 수십 명의 동포들을 보면서, 그의 마음은 증오와 복수심에 사로잡힌다. \! 귀족의 시대가 점점 끝나감에 따라, 테레노어는 남은 병력을 모아 유리카 요새에 대한 반격을 직접 지휘하기로 결정한다..."
"\c[1]\n[28] victory at Fort Eureeka has cemented \n[8]'s role as the true leader of the West, and the hero of the Donari Temple.\! News of \n[8]'s deeds have spread throughout the entire human world...\! and now the world looks to Fort Eureeka, where it will see the coming of a moment of reckoning.\! In the minds of those who stand on either side of the lines of battle, today's victor will determine the fate of Tahnra.","\c[1]\n[28] 유리카 요새에서의 승리는, 서부의 진정한 지도자이자 도나리 교단의 영웅으로서 \n[8]의 역할을 확고히 다졌다. \! \n[8]의 행동에 대한 소식은 전 인류에게 퍼졌다... \! 그리고 이제 온 세계가 유리카 요새를 주목한다. 심판의 순간이 온다면 이 곳에서 정해질 것이다.\! 전열의 양쪽에 서 있는 사람들은, 오늘의 승리자가 탄라의 운명을 결정지을 것이라고 믿어 의심치 않는다."
"\c[1]As a massive army approaches Fort Eureeka, \n[8]'s heart becomes heavy, as clearly, the East has not given up.\! Outnumbered, the Western forces prepare their defenses in hopes this will be the final battle of the war.","\c[1]대규모 군대가 유리카 요새에 접근함에 따라 동부군이 포기하지 않은 것이 분명해지자, \n[8]의 마음은 무거워진다. \! 수적으로 우세한 서부군은 이것이 전쟁의 마지막 전투가 되기를 바라며 방어를 준비한다."
\c[1]History will remember this day for centuries to come...,\c[1]역사는 앞으로 수 세기 동안 이 날을 기억할 것이다...
