ENGLISH,KOREAN
"Honored to finally speak to you in the flesh, Paladin.\! Shame that it has taken this long.","마침내 직접 대화하게 되어 영광입니다, 성기사님. \! 이렇게 오래 걸리다니 안된 일이지요."
"I know it doesn't matter anymore, but one of my biggest regrets is not wising up to Zanatus earlier.\! I'd have slit Casamir's throat in a heartbeat and put a quick stop to all the child kidnapping nonsense.\! I'd have preferred to kill you in combat, not destroy your soul by kidnapping your son.","더 이상 중요하지 않다는 건 알지만, 내 가장 큰 후회 중 하나는 자나투스에게 더 일찍 접근하지 못한 겁니다. \! 카사미르의 목을 단숨에 베어서, 아이들을 납치하는 말도 안되는 일을 빠르게 막을 수 있었을 텐데요. \! 당신의 아들을 납치해서 영혼을 파괴하는 것보다는, 전투에서 당신을 죽이고 싶었죠."
...Why did you destroy the Temple?,...교단은 왜 파괴한 겁니까?
"All I did was expedite the inevitable.\! The temple was just another part of an old paradigm, one on life support because people like you.",내가 한 일은 불가피한 일을 신속히 한 것 뿐입니다. \! 교단은 단지 구체제의 또다른 부분일 뿐입니다. 당신 같은 사람들 덕분에나마 명맥을 유지한 거지요.
A man like you lead down this path of bloodshed.\! Unfortunate.,당신과 같은 이는 유혈이 낭자한 길을 걷는 겁니다. \! 불운한 일이에요.
"This coming from Diana, the ""Goddess of War"", they call you.\! This mighty Paladin whose name inspires terror... and whose lifetime of crusade has spilt blood that would turn the seas red.\! I heard how you killed Casamir...\| Is this how you and your order have always operated?\! If so, perhaps you're more honest than I give credit.\! Or more warped by what you've become.","다들 ‘전쟁의 여신’이라 부르는 다이애나로부터 이런 말을 들을 줄이야. \! 이 위대한 성기사의 이름은 공포를 불러일으키죠... 당신의 일생에 걸친 성전은 바다를 붉게 물들일 만큼 피를 흘려왔을테고. \! 카사미르를 어떻게 죽였는지 들었습니다. \| 이것이 당신과 당신의 기사단이 항상 해오던 방식입니까? \! 그렇다면, 아마도 내가 생각했던 것보다 더 정직한 분인가보군요.\! 아니면 그 이상으로 더 비틀렸거나."
You don't know what I've become.,내가 어떤 존재가 되었는지 당신은 모릅니다.
"I see it in your eyes, you and I are nothing more than killing machines.\! We've lost everything else to become what we are.\! Is all this power worth it?\! Do those you fight for deserve your sacrifice?","당신의 눈에서 볼 수 있지요, 당신과 나는 그저 살육 기계일 뿐입니다. \! 그렇게 되기 위해 그 외의 모든 것들을 다 잃었죠. \! 이 모든 힘이 그럴 가치가 있었습니까? \! 당신이 지키고자 싸우는 이들에게 그런 희생의 가치가 있기는 한겁니까?"
"But having pursued my convictions as I see fit, and not giving myself to a band of ingrates who will never be able to pay me back their due, my mind is still clear.\! Soon, we will use our power to kill Zanatus, and if there is justice in this world, everyone will then learn what they've taken from you.","하지만 내가 적절하다 생각하는 대로 나는 내 신념을 추구했고, 내게 영원히 갚지 못할 빚을 진 배은망덕한 무리에게 내 자신을 맡기진 않았기에, 내 정신은 여전히 명료합니다. \! 곧, 우리는 자나투스를 죽이기 위해 우리의 힘을 사용할 것이고, 이 세상에 정의가 있다면 모든 이들은 당신에게서 무엇을 빼앗았는지 알게 될 겁니다."
