ENGLISH,KOREAN
Edelia...,에델리아...
Dear Sister...\| My shame knows no bounds...,자매님... \| 너무도 부끄러워요...
"You are my Bonded, until death.\! What matters most is that you are alive.","당신은 내 결속 상대에요, 죽음이 우리를 갈라놓기 전까지. \! 가장 중요한 건 당신이 살아있다는 거죠."
That black knight...\| he slayed all of the warriors.\! The cultists gave us a choice - to serve them or watch the children die.,검은 기사는... \| 그가 모든 교단의 전사를 베었어요.\! 광신도들은 우리에게 선택지를 남기지 않았어요 - 그들을 위해 싸우지 않으면 아이들이 죽는 걸 봐야 했죠.
"Children...\| Edelia, where is Alex??","아이들을... \| 에델리아, 알렉스는 어디 있죠?"
"I do not know.\! They were all taken away.\! To be ""re-educated"" to serve Zanatus.\! They killed any priestesses who dared to object...",저도 모르겠어요.\! 모두 끌려가 버렸어요.\! ‘재교육’을 받아 자나투스를 섬기도록 말이에요.\! 감히 거기에 반대한 여사제들은 그들이 모두 죽였어요...
Diana...,다이애나...
"...At least, we Bonded are reunited.\! It is time for you to go to war, Edelia. By my side.","... 최소한, 우리 결속된 이들이 다시 만나게 되었어요. \! 이제 당신이 전쟁에 나설 때가 되었어요, 에델리아. 내 곁에서 함께 싸워요."
"I will spend my entire life's blood for you, Sister. May we be whole once again.","제 마지막 피 한 방울까지 당신을 위해 흘릴께요, 자매여. 우리가 다시 온전한 하나가 되기를."
