ENGLISH,KOREAN
The village of Eastwall...\| the people seem relieved to see us.,이스트월 마을...\| 사람들이 우릴 보고 마음을 좀 놓는 것 같군.
The fighting has left their doorstep. Things can get back to normal.,전투가 저들의 문간을 떠났으니까. 모든 것이 이제 정상으로 돌아가겠지.
"We have some time before our next mission.\! Eastwall will be our ""Home Base"" for now.\! We can trade with the locals, maybe recruit some of them into our force.\! I'll be at the blacksmith giving my gear a touch-up, catch you later.","다음 임무까지 시간이 좀 남았어. \! 이스트월은 이제 우리 ‘기지’가 될 거야. \! 지역 주민들과 거래도 하고, 우리 부대를 보충할 수도 있지. \! 나는 대장장이한테 가서 장비를 손 좀 봐달라고 해야겠어, 나중에 보자."
"Hey, \n[8]! Let me show you around.\! No need to rush, we can relax a bit now. We can talk and get caught up with each other!\! And as Zelos said, this is a chance for us to make improvements to our Squads and troops by trading with the locals.","이봐, \n[8]! 내가 구경 시켜줄게. \! 서두를 필요 없으니, 잠깐 쉬자. 서로 이야기도 나누고 어떻게 지냈는지도 물어보고 말이야! \! 젤로스 말처럼, 우리가 지역 주민들과 교역하면 우리 부대와 병력도 개선할 수 있을 거야."
"On the top is the Resource Bar.\! This shows how much Gold, Resources, and Tech Points we have.","위에 있는 건 자원 표시줄이야. \! 금화와 자원, 기술 포인트가 얼마나 있는지 알려주지."
"On the top right, we can see our Faction Rank, and progress toward the next rank.","오른쪽 위에 있는 것이 진영 랭크인데, 다음 랭크까지의 진행률을 보여줘."
"On the left are all the things we can do at our Home Base.\! If you need me to walk you through these, click on the info icon and I'm happy to help!\! And, or, check out the Tutorials option. Don't be afraid to check this any time for helpful guides!","왼쪽에는 기지에서 할 수 있는 것들이 모두 표시돼. \! 혹시 전반적인 안내가 필요하면 정보 아이콘을 눌러줘, 내가 도울게! \! 그리고, 전술 가이드 옵션도 확인해 봐. 도움이 필요하면 언제든지 볼 수 있어!"
"When you're all finished up with the Home Base, just ""Deploy"" to move on to the next chapter.",기지에서 할 일을 다 마치고 나서는 ‘출격’을 누르면 다음 장으로 이동할 수 있어.
