"It'll be alright, kiddo. These people are expecting you.","괜찮을 겁니다. 이들은 당신을 기다리고 있었으니까요."
"Oh...\| alright, then. Thank you for keeping me safe, Captain Antares...","아...\| 알겠어요, 그럼. 절 안전히 보호해 주셔서 감사해요, 안타레스 대위님..."
"Please, join us, young Florina!","부디, 함께 가시지요, 플로리나 아가씨!"
"Welcome to Armitage, child of Donar. I am an official of the Donari Temple. We heard of fierce battles outside the capital. Thank Donar you've arrived safely.","도나르의 아이여, 아미티지에 온 것을 환영한단다. 나는 도나리 교단의 대표자야. 수도 밖에서 치열한 전투가 있었다고 들었는데. 도나르께서 보우하사, 네가 안전히 도착해 다행이구나."
"...What do you need me to do, sir?","...제가 무엇을 하면 되나요, 선생님?"
"Oh... nothing, nothing. That is to say, simply make yourself comfortable here in Armitage. Some acolytes of the Sisterhood of Mercy will tend to your needs.\! When the time comes, just follow along as they guide you through the process.\! By the end of today, it is very likely that you will be sanctioned to be Veridia's Empress.","오... 아무것도, 아무것도 하지 않아도 된단다. 그저 여기 아미티지에서 네 집에 있는 것처럼 편하게 지내렴. 자비의 자매회 수도사 몇 명이 네 시중을 들어줄거야.\! 때가 되면, 그들이 알려주는 절차에 따라서 움직이면 된단다.\! 아마 오늘이 끝나기 전에, 아주 높은 확률로 네가 베리디아의 여황으로 즉위하게 될 거란다."
...What in all the world does an Empress do?!,"...세상에나, 여황님이요? 여황님은 무슨 일을 하게되는 건가요?"
