ENGLISH,KOREAN
Narima is very confident in the Sayunaa strategy. Claims that her people wish for outside intervention.\! What do you think? Are we doing the right thing here?,나리마는 사유나 전략에 아주 확신이 있어. 자기 사람들은 외부의 간섭을 원한다고 주장하네. \! 어떻게 생각해? 여기서 하는 일이 옳은 걸까?
"To be frank, no.",솔직히는 아니지.
"Alright, then.",좋아 그럼.
"That doesn't mean it's not strategically sound.\! Indeed, it may be the only way to pull the Sayunaari away from the Imperial yoke.\! Morally, I find it an alarming shift from your former attitude toward this war.\! Perhaps, then, it is better that you are our leader, and I simply the vizier.","그렇다고 전략적으로 견실하지 않다는 뜻은 아니야. \! 사실, 그것이 사유나인들을 제국의 멍에에서 끌어내는 유일한 방법일지도 몰라. \! 도덕적으로는, 나는 이 전쟁에 대한 네 태도가 굉장히 급격하게 바뀐것이라고 생각해. \! 그렇다면 아마, 네가 우리의 지도자가 되고 난 그저 조언가가 되는 편이 좋을 지도 몰라."
"I see...\| you baffle me sometimes.\! On one hand, when I vow to have the cultists utterly destroyed, I see only your approval.\! But now...","알겠어.. \| 넌 가끔 날 당황시킨다니까. \! 한 편으로, 내가 광신도들을 완전히 궤멸시키겠다고 맹세할 때, 나는 네 지지만을 받았는데.\! 하지만 이제..."
"I just pray that the Sayunaari do not have to suffer, by our hand or by Casamir's.\! Their history is plagued with suffering.",나는 사유나 인들이 우리나 카사미르의 손에 의해 고통받지 않기를 기도할 뿐이야. \! 사유나의 역사는 고통으로 가득해.
Then I hope they choose wisely.,그렇다면 난 그들이 현명한 선택을 하기를 바랄 뿐이야.
