ENGLISH,Russian
Chapter 7: Tidereaver ,Глава 7: Пираты Тайдривера
"Liberators, I am a friend. For allowing me to be free, I am in your debt. I am Narima.","Я на вашей стороне. Вы меня освободили, и теперь я в долгу перед вами. Меня зовут Нарима."
"\n[8]. Well met. You were one of the slaves here, Narima?","\n[8]. Очень приятно. Тебя здесь держали в неволе, Нарима?"
"...Yes. I was to be sold as a slave. But before that, I wanted to free them.","...Да, меня собирались продать в рабство. Но до того я хотела освободить других рабов."
"Then you are indeed a friend...\| please join us for now, Narima. We could use your knowledge of the Tidereavers for sure.","Значит, мы и правда союзники...\| присоединяйся к нам, Нарима. Твои знания пиратов Тайдривера нам очень помогут."
"My blade is yours to command, \n[8].","Мой клинок к твоим услугам, \n[8]."
Donar has granted me allies...\| I will finally be free of these monsters!,Донар даровал мне союзников...\| Наконец-то я разделаюсь с этими чудищами!
Donar has granted me allies...\| I will finally be free of these monsters!,Донар даровал мне союзников...\| Наконец-то я разделаюсь с этими чудищами!
