ENGLISH,Russian
Chapter 26: Stormrook Looms,Глава 26: В тени Штормрука
Stormrook is finally ours. We're in the belly of the beast - no turning back now!\! Move our base of operations here - Stormrook will be our springboard to assault Rimorgue City.,"Штормрук наконец-то наш. Мы в самом сердце угрозы, и обратного пути больше нет!\! Теперь наша главная база здесь: через Штормрук мы отправимся на штурм Риморга."
"Brood of Kalytos the Red, the time is now!\! Dive onto Stormrook and destroy the invaders!","Род Калитоса Красного, время пришло!\! Атакуйте Штормрук и уничтожьте захватчиков!"
"Didn't learn the first time, \n[8]?\! You'll pay a heavy price for your arrogance.","В первый раз не дошло, \n[8]?\! Ты дорого заплатишь за свою наглость."
"This is our last chance!!\! We are the elite, the proudest sons of Veridia... today we defend our homeland!!\! Knights of the 1st Army, push south and make \n[8] regret ever coming here!","Наш последний шанс!\! Мы — элита, лучшие сыны Веридии... и сегодня мы встанем на защиту своей Родины!\! Рыцари Первой Армии, наступаем на юг! Пусть \n[8] пожалеет о приходе сюда!"
"War historians have always salivated at the idea of a decisive battle taking place here, at the Rimorgue River Valley.\! But rarely would any army would be in a position to oppose whoever controls it.\! Here we stand now, about to face the best of Casamir's army.\! Our truest test begins now...\| and to today's victor goes the fate of the world.","Военных историков всегда восхищала идея решающей битвы здесь, в долине реки Риморг.\! Но мало какая армия могла бы противостоять тем, кто её удерживает.\! Но вот мы здесь, и скоро нам предстоит сражения с элитой армии Казамира.\! Главное испытание началось...\| и тому, кто одержит победу, и предстоит определять судьбу мира."
"Stuck in a castle, just like before...\| Casamir, just to hunt you down, I'll find a third chance at life if I die today...","И опять он забился в замок...\| Казамир, даже если сегодня я погибну, я найду способ воскреснуть второй раз и приду по твою голову..."
"Not this time.\! \n[8], show them the power of the Nephilim Army.","Только не сегодня.\! \n[8], покажи им мощь Армии нефилимов."
