ENGLISH,Russian
"\c[1]\n[8] leads \n[27] army into the heart of enemy territory, and seizes Fort Eureeka.",\c[1]\n[8] ведёт свою армию вглубь вражеской территории и захватывает форт Эврика.
"\c[1]This victory shocks the world.\! Duke Terenor, who expected to win this war easily, now finds a powerful enemy force within a stone's throw of their capital at Rimorgue.","\c[1]Все в шоке от этой победы.\! Герцог Теренор, намеревавшийся победить быстро, вдруг обнаружил могущественного врага буквально в паре шагов от столицы Риморга."
"\c[1]Duke Terenor hears many pleas for a cease fire, but seeing scores of slain countrymen at the hands of the Western Army, his heart is consumed with hatred and a desire for revenge.\! Terenor decides to gather the remainder of his army to personally command a counter-attack on Fort Eureeka as the age of nobles teeters on the brink...","\c[1]Многие умоляли его заключить перемирие, но видя, сколько его граждан пало жертвами армии Запада, герцог Теренор ожесточился и возжелал мести.\! Он решает собрать остатки своей армии и лично возглавить контрнаступление на форт Эврика в преддверии заката эпохи вельмож..."
"\c[1]\n[28] victory at Fort Eureeka has cemented \n[8]'s role as the true leader of the West, and the hero of the Donari Temple.\! News of \n[8]'s deeds have spread throughout the entire human world...\! and now the world looks to Fort Eureeka, where it will see the coming of a moment of reckoning.\! In the minds of those who stand on either side of the lines of battle, today's victor will determine the fate of Tahnra.","\c[1]В результате победы у форта Эврика \n[8] ещё прочнее закрепляется в роли предводителя Запада и героя Храма Донари.\! Вести о подвигах, которые совершает \n[8], разносятся по всем людским землям...\! и теперь все взоры обращены на форт Эврика. Грядёт час икс, время решающей битвы.\! В глазах тех, кто стоит по обе стороны баррикад, победитель в этом бою определит дальнейшую судьбу Танры."
"\c[1]As a massive army approaches Fort Eureeka, \n[8]'s heart becomes heavy, as clearly, the East has not given up.\! Outnumbered, the Western forces prepare their defenses in hopes this will be the final battle of the war.","\c[1]Полчища врага приближаются к форту, и \n[8] с тяжёлым сердцем готовится к сражению. Очевидно, силы Востока ещё далеко не иссякли.\! Запад в меньшинстве, и они готовят оборону в надежде, что этот бой положит конец разгоревшейся войне."
\c[1]History will remember this day for centuries to come...,\c[1]Этот день точно войдёт в историю...
