ENGLISH,Russian
This can't be real...,Невероятно...
"Pretty outlandish stuff, eh?\! I try not to question it, makes things nice 'n easy.","Весьма странновато, согласен.\! Лично я предпочитаю не задавать лишние вопросы: меньше знаешь — крепче спишь."
What exactly would you have me do?,И что вы теперь от меня хотите?
"It is normal to resist your fate. I cannot force you to do anything.\! All I ask is that you put your trust in us, and all the Donari Temple, your newest ally.\! You are now known to the Followers of Zanatus...\| They will be coming for you.\! I have a small army here in Granheim Abbey. If you would join us, we are planning to return home, to our main Temple at Lemelin.","Противиться судьбе нормально. Я не могу тебя ни к чему принуждать.\! Лишь попрошу довериться нам и Храму Донари, твоим новым союзникам.\! Последователи Занатуса уже знают о тебе...\| И они за тобой явятся.\! Здесь, в аббатстве Гренхейм, у нас довольно небольшая армия. Если ты к нам присоединишься, мы отправимся домой, в главный Храм в Лемелине."
"You've saved my life.\| I owe you the benefit of the doubt.\! But only as far as your home Temple.\! Zelos could still be out there.\! He would be looking for me, so I can't just leave him behind...","Вы спасли мне жизнь.\| Было бы правильно вам довериться.\! Но только до главного Храма, хорошо?\! Зелос может быть где-то рядом.\! Вдруг он меня ищет. Я не могу просто его бросить..."
"My friend, if you and I truly are Nephilim, I will never leave your side, and no one will stand in our way.\! It is the fate of Nephilim to reunite as one, else all may be lost.\! No friend of yours will go unsaved, no enemy of yours will go unpunished.\! Of this, you have my word and my honor.","Мы с тобой оба — нефилимы, помни об этом. Я никогда тебя не оставлю и не позволю никому встать у нас на пути.\! Нефилимы должны воссоединиться, а иначе миру может настать конец.\! Мы обязательно спасём всех, кого ты считаешь друзьями, и сокрушим врагов.\! Даю тебе слово чести."
Hard to argue with that...,И не поспоришь...
"Come, I requested that a force of Temple warriors be assembled for us.\! Let us meet them.",Идём. Там собрались воины Храма по моему поручению.\! Они нас ждут.
