ENGLISH,Russian
...Where is everyone else?!,...А куда все подевались?!
Beatrix...,Беатрикс...
This is not supposed to happen...,Это не должно было произойти...
I should say so.,Да не говори.
"How about that.\! All four Nephilim, trapped... wherever this is, all by our lonesome.","Оба-на.\! Все четверо нефилимов оказались заперты... в этом странном месте, без помощи извне."
"Don't despair yet...\| There are several entry points in this tower.\! It is possible that the others are scattered in the area.\! Can't say for sure, darlings...","Не время отчаиваться...\| У этой башни есть несколько входов.\! Вполне возможно, что остальные тоже где-то поблизости.\! Тут уж как повезёт, дорогие мои..."
Seems we have no choice.\! Let's get on with it.,"Похоже, вариантов у нас нет.\! Вперёд."
