ENGLISH,RUSSIAN
"Rimorgue has fallen.\! Casamir just lost his best troops, and he's about to lose the capital.","Риморг пал.\! Касамир потерял свои лучшие войска, а вскоре потеряет и столицу."
"\c[1]Yes, the little empire has outlived its usefulness.\! But much progress has been made.\! We have all but erased the Donari Temple from memory!\! Now, we need but rid ourselves of the False One, and everything will fall into place quite easily.","\c[1]Да, эта маленькая империя всё равно нам теперь бесполезна.\! Мы уже многого достигли.\! От Храма Донари остались разве что воспоминания!\! Теперь надо только избавиться от Лжепророка, а всё остальное сложится само собой."
"The ""Little Empire""?\! How cavalier you are.\! I could have turned the tide against them.\! It is such a waste, but there is no point now, is there?","«Маленькая империя»?\! Как пренебрежительно.\! Я мог бы дать им отпор и оттеснить.\! Но теперь всё потеряно и не стоит даже пытаться, я прав?"
"\c[1]Oh, but you see, this is no bother. Let the False One dispose of Casamir for us. I've grown quite weary of the burden of his existence.\! The False One will come for the Lightfury... but instead, \n[5] will find only death.\! And so... will bring to a close the final chapter in the age of human ignorance.","\c[1]Но это нас нисколько не должно волновать. Пусть Лжепророк избавится от Казамира, нам это только на руку. Мне уже противно смотреть, как он строит из себя шишку на ровном месте.\! А потом Лжепророк прибежит в поисках Ярости Света... но вместо этого \n[5] найдёт только свою смерть.\! И тогда... дни этого затхлого человечества будут сочтены."
\n[8] has conquered the world in a matter of months.\! What makes you so confident that you'll be the one who beats \n[1]?,"\n[8] с союзниками завоевали весь известный нам мир за считанные месяцы.\! Почему ты так уверенно утверждаешь, что \n[1] скоро падёт?"
"\c[1]...\| Because I am the first who will attack \n[1] where \n[5] is vulnerable.\! \n[28] rise to power has made \n[1] arrogant, and severely lacking in foresight!\! \n[8] stands upon precarious ground and does not realize it.\! One only needs recognize this weakness, and act on it. Give it a little tip in the right direction.\! In the end, you will see true elegance of execution, my champion.","\c[1]...\| Потому что я нанесу удар первым. \n[1] не будет этого ожидать, и \n[5] не знает, что мне известны все слабые места.\! \n[28] на вершине успеха, но всё это произошло так быстро, что \n[1] за своей гордыней забывает об осторожности!\! \n[8] сейчас на очень зыбкой почве, но не осознаёт этого.\! А я вижу это как слабость и не премину этим воспользоваться. Достаточно небольшого толчка, чтобы всё пошло крахом.\! Ты еще увидишь, насколько изящно я умею воплощать в жизнь свои планы."
