ENGLISH,RUSSIAN
Beatrix.\! A moment of your time?,Беатрикс.\! Можно с тобой поговорить?
"Oh my gracious, how rude of me.\! I should have sought you out should I wanted to prattle on about nonsense.\! Do forgive me.","Ой, какая же я грубиянка.\! Совсем забыла прибежать к тебе, когда горела безудержным желанием поболтать о совершенно неважной ерунде.\! Ну разве так можно?"
No prattle.\! I want to know what you're doing.\! Why you are here with us.,Это не ерунда.\! Я хочу понять твои мотивы.\! Зачем ты нам помогаешь?
"This is why I do not trust the ""intellectual.""\! Too much education, not enough personality.\! You should make yourself useful and...\| disappear.","Вот почему я не общаюсь с умниками.\! Мозгов палата, но вы такие скучные.\! Тебя наверняка какие-то важные дела ждут...\| так что иди куда шёл."
Everyone has their desires.\! What do you wish to gain?,Никто ничего не делает просто так.\! Чего хочешь добиться ты?
"Desires? Darling, I'm already at the top of the totem pole.\! On that subject, why are you still here?\! Admiring the view? Cannot say I blame you.","Чего я хочу? Дорогой мой, посмотри на меня, я и так само совершенство, чего мне ещё хотеть?\! И вообще, я думала, что ты уже ушёл.\! Или задержался, чтобы полюбоваться? Я тебя понимаю, тут есть на что посмотреть."
"Charming. It seems you're not going to take me seriously.\! Just know that I am not convinced by ""prophecy"" and will be watching your every move.","Забавно. Видимо, серьёзного разговора у нас не выйдет.\! Чтоб ты знала, я во все эти «пророчества» не особо верю, поэтому буду следить за каждым твоим шагом."
Then what are you waiting for?\! All talk and no action makes Lysander a dull boy.,"Только следить?\! Даже не подкатишь как положено, Лисандер? Говорю же, скучный ты."
"Hmph, you underestimate me, sorceress.\! So many have done so.\! But I have always found a way when others haven't.\! Goodbye, Beatrix.","Ты зря меня недооцениваешь, чародейка.\! Но не ты первая и не ты последняя.\! Поверь, тебе не получится сбить меня с толку, сколько ни пытайся.\! Еще увидимся, Беатрикс."
