ENGLISH,RUSSIAN
No!!\| ...G-get away from me!!,Нет!!\| ...Н-не тронь меня!!
"I was going to put you down myself, but then I think you made mom a little angry.","Мне так хотелось прикончить тебя своими руками, но вот эту мать ты разозлил ещё сильнее."
You people don't understand...\| That cult...\| They are insane!!\! You know they think their god is coming back to rule this world?! I had no choice... I had no choice!!\! Everything that transpired was of their design... my only desire was to become the legitimate Emperor...,"Вы ничего не понимаете...\| Этот культ...\| Они лютые безумцы!!\! Вы в курсе, что они верят, будто их бог вернется и будет править нашим миром?! Они выкрутили мне руки... У меня не оставалось выбора!!!\! Во всём это виноваты только они... а я всего-то хотел стать законным императором..."
"Unngggh....\| Spare my life, please, \n[8]...","А-ах....\| Умоляю, не убивай меня, \n[8]..."
"Relax, it's only a flesh wound. You'll be wide awake for what's coming.","Успокойся, жить будешь... пока. Тебя еще ждёт кое-что похуже меня."
"Goodbye, Casamir.\! Give my regards to... whatever god tortures you in the afterlife.","Прощай, Казамир.\! Передавай привет от меня... не знаю, кто там будет мучить тебя в загробной жизни."
"Aggh!! W-what... no, I don't believe it! I can't!","А-а-а!! Ч-что... нет, этого не может быть! Не верю!"
You will.,Сейчас поверишь.
