"Treacherous swine! Your army is annihilated! Surrender yourself, and Veridia's forces will leave Sayunaa in peace.","Подлый предатель! Твоя армия разбита! Сдавайся, и веридийская армия покинет территорию Саюна."
"A thousand generations of curses upon you, Veridian scum. Mark my words, there will be a day when you bend the knee to us.","Будьте вы прокляты на тысячу поколений, веридийские подонки! Ещё настанет тот день, когда вы склоните головы перед нами."
"Final warning, Duke Rostam! Surrender, and return to your capital, or I will put you down myself!","Герцог Ростам, больше я повторять не буду! Отступи и возвращайся в свою столицу, или я лично заставлю тебя пожалеть об этом!"
You have indeed taken much from me...,Вы отняли у меня всё...
But at what cost?!,Разве оно того стоило?!
"AAAGH!!\! Die a coward, then!!","А-А-А!!\! Тогда умри, подлец!!!"
