ENGLISH,RUSSIAN
Legends 1A: Promise of Peace,Легенды 1A: Надежда на мир
As expected. Lord Godfrey was never going to let this happen peacefully.,Этого следовало ожидать. Лорд Годфри и не думал решать вопрос мирно.
"I must reach the capital, here. Be on guard, we can surely expect even more resistance than what we see now.\! Pray we do not face his elite Arbalest units again, they have proven quite deadly.","Я должен достигнуть столицы. Будьте начеку! Вряд ли это были последние вражеские отряды на нашем пути.\! Надеюсь, что стреломётчиков хотя бы получится избежать. Очень уж они опасные."
"Florina, I dread the idea of a bringing a child to this battlefield. But you must know that these men are coming for you.\! You must stay near me, but stay safe. Just until we make it to Armitage in one piece.","Флорина, при иных обстоятельствах я бы никогда не втянул ребёнка в бой. Но они охотятся именно за тобой.\! Держись рядом со мной, но не высовывайся. Вот доберёмся до Армитажа — тогда можно будет расслабиться."
"I will stay near! I trust you, Captain Antares!","Хорошо, я буду рядом! Я вам доверяю, капитан Антарес!"
Thank you. Donar watch over us.,Спасибо. И да поможет нам Донар.
"How absurd! This is the great hope for all Veridia? This small child?!\! What has she done to earn Donar's favor? What could she do?!\! Captain Antares, a true lapdog, to the very end. Arbalests, destroy him!","Что за бред? И это великая надежда всей Веридии? Это дитя?!\! Чем она заслужила милость Донара? На что она способна?!\! Капитан Антарес готов служить, даже не задумываясь, кому и зачем! Стеломёты к бою! Огонь!"
