ENGLISH,RUSSIAN
Legends 3A: Whispers from Grothnor,Легенды 3A: В Гротноре всё не спокойно
"It's been far too long since I've ventured this far into the edges of the frozen abyss.\! Fort Rittenbach. A monument of our heritage, and to our survival... still it stands.",Как же давно я не забредал так далеко в этот вечномёрзлый ад.\! Форт Риттенбах. Памятник нашему наследию и нашему выживанию... столько лет стоит уже.
"There, the Sayunaari seem to have fortified a central position within the fortress.\! I must wonder, why? Their reputation as such strident warriors, against these... petty bandits?\! No matter. Army of Embor, we shall rid Fort Rittenbach of these invaders and return Donar's glory to this place.","Силы саюнари прочно укрепились в самом сердце крепости.\! Вот только не пойму, почему? Они ведь отличные бойцы, а против них просто... шайка бандитов?\! Ну да ладно. Воины Эмбора, избавим форт Риттенбах от чужаков и отвоюем его во славу Донара!"
You...\| you must be the lord of these lands.\| Duke Jaromir?,"Наверное...\| вы местный лорд, верно?\| Герцог Яромир?"
"Donar's mercy...\| Y-yes, and I am afraid you have me at a disadvantage, for I do not know your name.","Волею Донара...\| Он самый. А вот вас я не знаю, простите."
"Ragavi, General of the Sayunaari Defense Army of Dakur.\! We owe you our lives. But I am afraid all we may have done nothing but doom you alongside all of us.","Рагави, генерал защитного корпуса дакурской армии саюнари.\! Мы вам жизнью обязаны. Вот только боюсь, что это лишь временно, потому что теперь все мы обречены."
"Honored, General Ragavi of the Sayunaari. I'm afraid you owe us nothing, for surely this rabble was no threat to you...","Приятно познакомиться, генерал Рагави. Не думаю, что вы нам обязаны, ведь вы и сами запросто бы справились с этим сборищем..."
"No...\| here they come once again! Steel yourselves, Emborians!","Нет...\| они опять нападают! Воины Эмбора, к бою!"
