ENGLISH,RUSSIAN
"Well met, Duke Jaromir.\! I can't tell you how grateful I am that we crossed paths, to quickly become allies like this.\! It's the perfect place to build up a power base - far from Casamir's core armies.","Приветствую, герцог Яромир.\! Я очень ценю, что судьба свела нас и мы стали союзниками.\! Здесь, подальше от армий Казамира, отличное место для создания опорной базы."
"You honor me, Avatar of Donar.\! That my name and the people of Embor will be foundational in this new holy war - I never dreamed of being given the opportunity to pursue glory such as this.\! It is worth sacrificing everything... my lands, and my life.","Помогать тебе — большая честь для меня, Аватар Донара.\! Я и мой народ сыграем ключевую роль в этой священной войне. Я и вообразить не мог, что Эмбор удостоится такой чести.\! Ради этой великой цели я готов пожертвовать всем... своим герцогством и даже своей жизнью."
"Let's not be sacrificing anything yet, friend.\! Hey, can you tell me a little about the Duchy of Embor?\! We Southerners only ever hear about it as some distant, cold, lonely place, heh.","Друг мой, давай постараемся обойтись без великих жертв.\! Ты не мог бы рассказать мне подробнее о герцогстве Эмбор?\! Нам, южанам, всегда говорили, что это какое-то далёкое, холодное и пустынное место. Ха."
"Cold and distant to you indeed.\! But that is part of what defines us Emborians. The Northern plains are vast and unforgiving.\! For centuries, Embor has acted as Veridia's bulwark to the North and East, just as Stormrook protects its South, and the Herald Sea protects its West.","Да, для вас оно и правда далёкое и холодное .\! Но именно это и формирует характер эмборианского народа. В бескрайних северных просторах жизнь очень непростая.\! Штормрук — это цитадель, которая защищает южные рубежи Веридии. Море Геральд обеспечивает защиту в западном направлении. Ну а Эмбор веками служил оплотом северных и восточных границ Веридии."
"Yeah, your troops seem to brush off the cold like it's nothing.\! That's impressive - I'm sure most of Casamir's men aren't so resilient, which in part explains why their presence was so weak here.","Да, твоим воинам мороз словно нипочём.\! Я прямо проникаюсь к ним уважением. Вряд ли войска Казамира так же хорошо переносят холод. Подозреваю, что именно поэтому их тут практически и не было."
"For that, we are fortunate. For we Emborians are few in number.\! Our lands are not as bountiful as the green valleys of Rimorgue.\! So easily the Southerners have forgotten their roots - Embor was the first settlement in Veridia.","Надеюсь, что так оно и останется. В Эмборе народу живёт не так уж и много.\! В отличие от зелёных долин Риморга, у нас тут мало что произрастает.\! Поэтому южане так быстро и позабыли о своих корнях, хотя первое поселение в Веридии было основано именно в Эмборе."
Oh yeah?\! Wouldn't have guessed!,Неужели?\! Вот бы никогда не подумал!
"Yes. Ancient Donari texts tell of a great migration, escaping from Zanatus's power, from the East... the vast frozen landscape of Grothnor.\! When our ancestors arrived in Felnamia and later Embor, we finally were able to forge a home for ourselves to prepare for the coming reckoning with Zanatus.\! Not unlike what we are living here, today.\! And just the same, the demon will suffer ultimate defeat by your very hands.","Однако это так. В древних сказаниях Донари говорится о великой миграции, когда наш народ бежал из-под власти Занатуса с востока... из страны вечного льда, Гротнора.\! Наши предки сначала поселились в Фелмании, а позже в Эмборе. Здесь они наконец смогли основательно укрепиться и подготовиться к решающей битве с Занатусом.\! И вот история повторяется.\! Как и в тот раз, ты снова сокрушишь демона, только теперь уже окончательно."
"Ummmm, well yes! Let's hope!\! Gonna need all the help I can get with that one, I'm sure...","Эм... Да, конечно! Будем надеяться!\! Но для этого мне нужна вся помощь, которую я смогу получить..."
