ENGLISH,GERMAN
"...Okay, I'm certain I haven't touched drink today but I think I'm hallucinatin' already!","… Also ich bin ganz sicher, dass ich heute keinen Tropfen angefasst habe, aber trotzdem habe ich schon Halluzinationen!"
"Welcome back, Diana.\! How do you feel?","Willkommen zurück, Diana.\! Wir fühlt Ihr Euch?"
Grateful to be home...\! H-how long has it been?,"Dankbar, zu Hause zu sein …\! W-Wie lange ist es her?"
Only a few moments for us.,Für uns nur ein paar Augenblicke.
"By Donar's will, the boon of Galzus has come to Tahnra...\| I only hope I am a worthy steward of this gift.","Bei Donars Willen, der Segen von Galzus ist nach Tahnra gekommen …\| Ich hoffe nur, dass ich dieses Segens würdig bin."
Hell's bells. The Goddess of War just got even more... Goddessy.\! It just got reeeeeeal bad to be a bad guy.,Potztausend. Die Göttin des Krieges wurde gerade noch … göttlicher.\! Auf die Bösewichte kommen echt üüüüüble Zeiten zu.
