ENGLISH,GERMAN
"The black knight, he is defeating the Paladins so easily!\! W-we are doomed...",Der schwarze Ritter besiegt die Paladine mit Leichtigkeit!\! W-Wir sind verloren …
Those cultists can't get inside with my barrier up!\! Stand back...,"Meine Barriere wird verhindern, dass die Kultisten hereinkommen!\! Tretet zurück …"
Do you really think it'll hold?!,"Meint Ihr wirklich, dass sie hält?!"
"The barrier hasn't failed me yet!\! Get everyone out of here, Jebediah - don't worry about me!","Noch hat diese Barriere mich nicht im Stich gelassen!\! Bringt alle hier weg, Jebediah – macht Euch keine Sorgen um mich!"
I-I'm sorry...\| You weren't supposed to fight back...,E-Es tut mir leid …\| Ihr hättet Euch nicht wehren sollen …
Uggh...\| Jebediah...,Uff …\| Jebediah …
"You've taught me so much, Grandmaster...\| Now I can better serve the true god, Zanatus.\! H-he's coming back, you know.\! And I'll be among the first to be rewarded...","Ihr habt mich so viel gelehrt, Großmeister …\| Nun kann ich dem wahren Gott Zanatus besser dienen.\! E-Er wird zurückkehren, wisst Ihr.\! Und ich werde zu den Ersten gehören, die er belohnt …"
