ENGLISH,GERMAN
"I guess you've made your intentions clear, huh?","Ihr habt Eure Absichten wohl mehr als deutlich gemacht, hm?"
"I have, \n[8].\! But have you?","So ist es, \n[8].\! Aber habt Ihr das auch?"
"The Temple would have me be some sort of fulfillment of a prophecy.\! What's one to do, Lysander?","Der Tempel wünscht sich, dass ich so etwas wie die Erfüllung einer Prophezeiung sei.\! Was soll ich nur machen, Lysander?"
"It depends on what you want.\! You could simply disappear, and not concern yourself with supernatural myths.\! But you're not going to do that, are you?","Das hängt davon ab, was Ihr wollt.\! Ihr könntet verschwinden und Euch mit übernatürlichen Mythen einfach nicht befassen.\! Aber danach steht Euch nicht der Sinn, oder?"
"These are my people.\! Every Veridian.\! Part of me wants to be what they want me to be, to save them from the darkness we all know is coming.\! Guess I never cared much about this new world that seems to be creeping in.","Dies ist mein Volk.\! Jeder Veridianer.\! Ein Teil von mir will so handeln, wie sie es von mir erwarten, sie vor der einbrechenden Dunkelheit retten.\! Schätze, diese neue Welt, die langsam, aber sicher entsteht, hat mich nie besonders interessiert."
And what world is that?,Und was für eine Welt soll das sein?
"As children we are taught about a past that's so much greater, and men so much nobler.\! But it seems the legends of the past are forever gone.\! Now we're stuck with weak and petty leaders.\! Men of the past would give their lives to ensure a lasting peace, but now there is so much less hope, so much more cynicism.\! I've heard other Succession War orphans say the same.\! But to the generation before us, this attitude seems...\| revolutionary.\! Why? It seems so simple...","Als Kinder werden uns Geschichten von einer viel herrlicheren Vergangenheit und viel edleren Menschen erzählt.\! Aber es scheint, als seien die Legenden von früher für immer verloren.\! Jetzt haben wir schwache, belanglose Herrscher am Hals.\! Früher hätten die Menschen für einen währenden Frieden ihr Leben gegeben, aber heute gibt es viel weniger Hoffnung und so viel mehr Zynismus.\! Dasselbe hörte ich bereits von anderen Waisen des Thronfolgekrieges.\! Doch für die Generation vor uns scheint diese Einstellung …\| revolutionär zu sein.\! Warum? Es wirkt so einfach …"
"In an age of lies, the truth is an act of dissent.\! And the greatest enemy of evil is an awoken people - those who feel just as you do.\! You know, it is quite intriguing to me, \n[8], when we consider the rebellion of General Antares.\! Here we now stand, opposed to our own government, just as he was.\! Perhaps it was Antares who could see further ahead than any of us.\! History will likely see you as the inheritor of the very rebellion you fought to put down...","In einem Zeitalter der Lügen ist die Wahrheit ein Widerspruch.\! Und der größte Feind des Bösen ist ein erwachtes Volk – jene, die Eure Gefühle teilen.\! Wisst Ihr, \n[8], es fasziniert mich, wenn wir die Rebellion von General Antares in Betracht ziehen.\! Genau wie er stellen wir uns nun gegen unsere eigene Regierung.\! Möglicherweise war Antares ein größerer Visionär als jeder von uns.\! Für die Geschichtsbücher werdet Ihr die Person sein, die genau die Rebellion weiterführte, die Ihr vormals niederschlagen wolltet …"
