ENGLISH,GERMAN
"\c[1]Throne room, Imperial palace at the capital\c[0]",\c[1]Thronsaal des Kaiserpalasts der Hauptstadt\c[0]
"You gaze upon the throne as though you will never have it, Prime Minister.\! ...As if you actually need the Temple's permission.","Ihr blickt auf den Thron, als wäre er unerreichbar für Euch, Premierminister.\! … Als würdet Ihr die Erlaubnis des Tempels benötigen."
"I could sit there at any moment.\! But I dare not...\! To you people, what this throne represents might seem like a trifling matter.\! But to me... it is my entire life.\! The Temple will confirm me, and then no one will question my rule.","Ich könnte jederzeit darauf Platz nehmen.\! Doch ich wage es nicht …\! Für Leute wie Euch scheint der Thron möglicherweise nur von geringer Bedeutung zu sein.\! Aber für mich … bedeutet er alles.\! Der Tempel wird meinen Anspruch bekräftigen, und dann wird meine Herrschaft niemand mehr infrage stellen."
"As you wish, but short of that, we will find a way.\! We have word that the False One has reached Lemelin Monastery.\! The casus belli is now yours, you may make your next move.","Wie Ihr mögt, und falls nicht, werden wir einen Weg finden.\! Uns ist zu Ohren gekommen, dass der falsche Götze das Lemelin-Kloster erreicht hat.\! Nun habt Ihr Euren Casus Belli, Ihr könnt Euren nächsten Schritt machen."
"Then the orphan and the Paladins will soon be utterly destroyed, and the Temple will fall in line.",Dann sollen das Waisenkind und die Paladine gänzlich vernichtet werden. Daraufhin wird auch der Tempel fallen.
"We have concern that you don't take the game of war seriously enough, Prime Minister.\! The Temple warriors have thwarted even us time and time again.\! You must bring overwhelming force, or you will lose.","Uns treibt die Besorgnis um, dass Ihr das Kriegsspiel nicht ernst genug nehmt, Premierminister.\! Die Krieger des Tempels haben uns mehr als einmal einen Strich durch die Rechnung gemacht.\! Ihr müsst eine überwältigende Streitmacht aufs Schlachtfeld führen, andernfalls werdet Ihr verlieren."
"What are you worried about, anyway?\! General Lysander, one of our best tacticians, will command the army.\! We will bring our gunner squads to bear as well.\! And now, I've had just about enough of justifying myself to you people. Off with you!","Ihr solltet Euch nicht so viele Sorgen machen.\! General Lysander, einer unserer besten Strategen, wird die Armee befehligen.\! Selbst unsere Kanoniere werden dort sein.\! Und jetzt habe ich keine Lust mehr, mich vor Leuten wie Euch zu rechtfertigen. Hinfort!"
"Best of luck in the coming battle, Prime Minister.","Viel Glück bei der kommenden Schlacht, Premierminister."
