ENGLISH,GERMAN
...Who are you?,… Wer seid Ihr?
"Your best friend today, nothing more, Razehl.","Euer bester Freund heute. Mehr ist nicht wichtig, Razehl."
How do you know my name?,Woher kennt Ihr meinen Namen?
"Take this dagger. You will need to fight your way out alongside us.\! Razehl, we know how they have treated you. These guards deserve to die.","Nehmt diesen Dolch. Ihr werdet Euch an unserer Seite einen Weg in die Freiheit erkämpfen müssen.\! Razehl, wir wissen, wie sie Euch behandelt haben. Diese Wachen verdienen den Tod."
"No disagreement from you, I see.","Wie ich sehe, sind wir uns da einig."
"We will have to take advantage of this facility's lighting mechanism.\! Here, we can trigger this switch and turn off the light in a segment of these hallways.\! Without the light, we will have the freedom to cut down an unsuspecting enemy from the shadows.",Wir werden den Beleuchtungsmechanismus der Anlage nutzen müssen.\! Hier können wir diesen Schalter umlegen und das Licht in einem Teil dieser Korridore ausschalten.\! Ohne Licht können wir arglose Gegner aus dem Schatten niedermetzeln.
