ENGLISH,GERMAN
"Rimorgue has fallen.\! Casamir just lost his best troops, and he's about to lose the capital.",Rimorgue ist gefallen.\! Casamir hat seine besten Truppen verloren und wird demnächst die Hauptstadt verlieren.
"\c[1]Yes, the little empire has outlived its usefulness.\! But much progress has been made.\! We have all but erased the Donari Temple from memory!\! Now, we need but rid ourselves of the False One, and everything will fall into place quite easily.","\c[1]Ja, das kleine Kaiserreich hat seinen Dienst getan.\! Aber wir haben viel erreicht.\! Der Donari-Tempel ist aus den Köpfen der Menschen so gut wie verschwunden!\! Jetzt müssen wir uns nur noch des falschen Götzen entledigen, dann gibt sich alles Weitere."
"The ""Little Empire""?\! How cavalier you are.\! I could have turned the tide against them.\! It is such a waste, but there is no point now, is there?",Das „kleine Kaiserreich“?\! Wie gelassen Ihr das alles seht.\! Ich hätte das Blatt wenden können.\! So eine Verschwendung. Aber jetzt hat es auch keinen Zweck mehr.
"\c[1]Oh, but you see, this is no bother. Let the False One dispose of Casamir for us. I've grown quite weary of the burden of his existence.\! The False One will come for the Lightfury... but instead, \n[5] will find only death.\! And so... will bring to a close the final chapter in the age of human ignorance.","\c[1]Nun versteht doch, das ist gar kein Problem. Soll der falsche Götze doch Casamir für uns aus der Welt schaffen. Seine Existenz ist mir eine Last und ich bin ihr überdrüssig.\! Der falsche Götze wird Lichtzorn suchen … stattdessen aber nur den Tod finden.\! Und so … werden wir das letzte Kapitel dieser Epoche der menschlichen Ignoranz zu Ende schreiben."
\n[8] has conquered the world in a matter of months.\! What makes you so confident that you'll be the one who beats \n[1]?,"\n[8] hat die Welt innerhalb von Monaten erobert.\! Wie könnt Ihr so sicher sein, dass Ihr obsiegen werdet?"
"\c[1]...\| Because I am the first who will attack \n[1] where \n[5] is vulnerable.\! \n[28] rise to power has made \n[1] arrogant, and severely lacking in foresight!\! \n[8] stands upon precarious ground and does not realize it.\! One only needs recognize this weakness, and act on it. Give it a little tip in the right direction.\! In the end, you will see true elegance of execution, my champion.","\c[1] …\| Ich werde als Erster den richtigen Schwachpunkt angreifen.\! Der schnelle Machtgewinn hat \n[8] arrogant und wenig vorausschauend werden lassen!\! \n[8] bewegt sich auf dünnem Eis und merkt es gar nicht.\! Man muss diese Schwäche nur erkennen und ausnutzen. Einen kleinen Schubser in die richtige Richtung geben.\! Ihr werdet die Eleganz in der Vollendung des Plans noch erkennen, mein Streiter."
