ENGLISH,GERMAN
"Hey there, Diana!\! Little Alex has just been wanderin' around lookin' for somethin' to keep him busy - I figured he'd...","Grüßt Euch, Diana!\! Der kleine Alex war herumgestreift und hatte nach einer Beschäftigung gesucht … Ich dachte, er würde …"
...Diana?\|\| Hey now... what gives?,… Diana?\|\| Oha … was ist denn los?
You've taken quite a beatin'.\! 'N it's all been for the lot of us.\! Gettin' Alex back... but it still ain't enough I guess...,Ihr habt ganz schön was abgekriegt.\! Und zwar uns zuliebe.\! Wir haben Alex wieder … aber das reicht wohl noch nicht …
I thought it would be better...,"Ich dachte, es würde besser werden …"
We can only take so much.\! You're needin' rest my dear...\| Please sit this one out.\! You've done far more than your fair share...,"Wir haben alle unsere Grenzen.\! Ihr müsst Euch ausruhen, meine Liebe …\| Bitte bleibt hier einmal außen vor.\! Ihr habt mehr als Euren Anteil beigetragen …"
I have been lent the blessing of Galzus. His might will not be wasted.,Mir wurde Galzus’ Segen verliehen. Ich werde seine Macht nicht ungenutzt lassen.
"....\| Yeah, alright, I guess.","…\| Ja, gut, na schön."
Stefan...\| Alex has been through a lot and needs to be shown love.\! I cannot show it right now...,Stefan …\| Alex hat viel durchgemacht und braucht Liebe.\! Aber die kann ich ihm gerade nicht geben …
...\| I hear ya. Don't worry 'bout it...,…\| Verstehe schon. Macht Euch keinen Kopf …
