ENGLISH,JAPANESE
"Are you hearing me, gods above?!\! Can you not read my heart and soul?!\! I'll gladly throw my bits and baubles to the ground and desire no more...\! I am cleansed, a new man!\! I will walk the path of righteousness!\! Why do you not grant this accursed world clemency?!\! Why must you take her away?!\! Could you instead cause a quake here, or a flood there,\| why must you see fit to let her die?!",おい、神々とやら、聞いてるか！？\!俺の心を、魂を読めるか！？\!もう、金銀財宝全部ブチまけて、その場でくたばってやりてえ気分だぜ...\!そうすりゃ俺も、清められんだろ！\!正義の道とやらを歩めんだろ！\!だのになぜお前はこのクソ忌々しい世界に、一片の慈悲もよこさねえんだ！？\!どうしてその女を殺したんだ！？\!代わりに地震か洪水でも起こせねえのか？\|その女を見捨てるのがお前の正義なのか！？
"Alright, Diana...\| Have it your way...\! Let's just sleep it off, eh?",ちくしょう、ダイアナ...\|もうどうにでもなれってんだ...\!こうなったら一緒に肩組んでうたた寝でもしようや、な？
There they are.\! The last two souls in the resistance.\! End them...,いたぞ、やつらだ。\!レジスタンスの最後の2人だ。\!一思いに葬ってくれよう...
A storm... now?!,あ...嵐だと！？
Curse all this...,クソ食らえだぜ...
