ENGLISH,JAPANESE
Chapter 7: Tidereaver ,第7章:タイドリーバー 
"Liberators, I am a friend. For allowing me to be free, I am in your debt. I am Narima.",はじめまして。あなたが解放者だと言うなら私も協力するし、その恩は必ず返すつもりよ。私の名はナリマ、よろしくね。
"\n[8]. Well met. You were one of the slaves here, Narima?",私は\n[8]だ、こちらこそよろしく。ここで味方に出会えたのは幸運だった。君もここで奴隷にされていたんだろう、ナリマ？
"...Yes. I was to be sold as a slave. But before that, I wanted to free them.",...そうよ。そして、また奴隷として売られるところだったの。でも、その前になんとか仲間を助けてあげたくて。
"Then you are indeed a friend...\| please join us for now, Narima. We could use your knowledge of the Tidereavers for sure.",なら、我々は間違いなく君の味方だ...\|共に戦おう、ナリマ。君はタイドリーバーの内情を知っている。その知識はきっと大きな助けになるはず。
"My blade is yours to command, \n[8].",その通り。ではこの剣と弓、あなたのために使わせてもらうわ、\n[8]。
Donar has granted me allies...\| I will finally be free of these monsters!,ああ、ドナーがこの私に仲間をよこしてくれたのね...\|ついにあの鬼畜どもから自由になれる日が来たんだわ！
Donar has granted me allies...\| I will finally be free of these monsters!,ああ、ドナーがこの私に仲間をよこしてくれたのね...\|ついにあの鬼畜どもから自由になれる日が来たんだわ！
