ENGLISH,JAPANESE
This can't be real...,ありえない...
"Pretty outlandish stuff, eh?\! I try not to question it, makes things nice 'n easy.",浮世離れしててよくわかんねえだろ？\!まあ、気を楽にしたいなら、あまり考えすぎないこった。
What exactly would you have me do?,それで、私をどうするつもりなんだ？
"It is normal to resist your fate. I cannot force you to do anything.\! All I ask is that you put your trust in us, and all the Donari Temple, your newest ally.\! You are now known to the Followers of Zanatus...\| They will be coming for you.\! I have a small army here in Granheim Abbey. If you would join us, we are planning to return home, to our main Temple at Lemelin.",運命を受け入れぬのもよくあることだ。こちらから何も強制することはできない。\!私はただ、お前がドナー神殿と、新しい仲間を信頼してくれることだけを願っている。\!今となっては、お前の存在はザナトゥス教団に知られることとなった。\|今後どのような道を進むにせよ、追手が背後から忍び寄ってくるだろう。\!私はこのグランハイム修道院に、小さな兵団を抱えている。正式に私たちの仲間になるなら、我らの総本山であるレメリン神殿まで護送しよう。
"You've saved my life.\| I owe you the benefit of the doubt.\! But only as far as your home Temple.\! Zelos could still be out there.\! He would be looking for me, so I can't just leave him behind...",あなたは命の恩人だ。\|今はその善意を信じることにしよう。\!ただ、同行できるのはそこまでだ。\!ゼロスは今もどこかで囚われているだろうから...\!立場が逆なら、彼は私を探すはず。だから、放っておくことはできないんだ...
"My friend, if you and I truly are Nephilim, I will never leave your side, and no one will stand in our way.\! It is the fate of Nephilim to reunite as one, else all may be lost.\! No friend of yours will go unsaved, no enemy of yours will go unpunished.\! Of this, you have my word and my honor.",お前が本物のネフィリムなら、私はいつでもお前の味方だ。立ちはだかる壁は共に打ち倒そう。\!ネフィリムが互いに出会うのは運命であり、結束を失えば、すべての希望もまた失われる。\!お前の友が見捨てられることはなく、お前の敵が報いを逃れることもない。\!我々はここに、それを約束しよう。
Hard to argue with that...,ああ、わかった...
"Come, I requested that a force of Temple warriors be assembled for us.\! Let us meet them.",さあ、来なさい。既に先程、神殿の戦士たちを招集するように命じた。\!これから会いに行こう。
