ENGLISH,JAPANESE
"I guess you've made your intentions clear, huh?",どうやらあなたも、お気持ちをはっきりさせたようですね。
"I have, \n[8].\! But have you?",ああ、そうだとも、\n[8]。\!君はどうだ？
"The Temple would have me be some sort of fulfillment of a prophecy.\! What's one to do, Lysander?",神殿は私を、預言の中の存在か何かとみなしています。\!どうしたらいいでしょう、ライサンダー将軍？
"It depends on what you want.\! You could simply disappear, and not concern yourself with supernatural myths.\! But you're not going to do that, are you?",それは君次第だろう。\!行方をくらませ、宗教勢力から離れるのも1つの手だ。\!でも、そうするつもりはないのだろう？
"These are my people.\! Every Veridian.\! Part of me wants to be what they want me to be, to save them from the darkness we all know is coming.\! Guess I never cared much about this new world that seems to be creeping in.",ありません。\!この国の民...すべてのベリディア人の運命に関わることですから。\!私自身、人々が求める存在になりたい気持ちはあります。来るべき暗黒から母国を救うために。\!ただ正直、その到来しつつある新しい世界を、あまり気にしたことはありませんでした。
And what world is that?,「新しい世界」？
"As children we are taught about a past that's so much greater, and men so much nobler.\! But it seems the legends of the past are forever gone.\! Now we're stuck with weak and petty leaders.\! Men of the past would give their lives to ensure a lasting peace, but now there is so much less hope, so much more cynicism.\! I've heard other Succession War orphans say the same.\! But to the generation before us, this attitude seems...\| revolutionary.\! Why? It seems so simple...",子供の頃、かつて存在した偉大な文明と、高貴な民について教えられたでしょう？\!ただ、その伝説は、もう永遠に過ぎ去った古き良き時代です。\!今の人々は、愚かで卑劣な指導者に踏みつけにされている。\!昔の人は、平和の維持に情熱を捧げてきましたが、今の世に希望はなく、世間は怨嗟の言葉で溢れている。\!継承戦争の孤児たちも、そんなことを言っていました。\!でも、上の世代に言わせれば、そうした風潮は...\|革命の前触れだと。\!どうしてかって？それは...
"In an age of lies, the truth is an act of dissent.\! And the greatest enemy of evil is an awoken people - those who feel just as you do.\! You know, it is quite intriguing to me, \n[8], when we consider the rebellion of General Antares.\! Here we now stand, opposed to our own government, just as he was.\! Perhaps it was Antares who could see further ahead than any of us.\! History will likely see you as the inheritor of the very rebellion you fought to put down...",嘘の時代に生きていると、真実を述べることが国家への反逆になる。\!そして、嘘吐き悪党の最大の敵は覚醒した者...つまり、君と同じように考えている人間だ。\!\n[8]よ、アンタレス将軍が反乱を起こした理由、考察してみたことはあるかな？\!私たちは今、彼と同じ道、つまり政府に反逆する道を歩んでいるのだ。\!おそらく、誰よりも早くこの国に潜む悪を見通していたのが、アンタレスだったのだろう。\!そして、未来の歴史書は君のことを、「自身が鎮圧した反乱の継承者」という、奇妙な肩書で記録するだろう...
