ENGLISH,JAPANESE
So what happened to your personal ambition?,ん、何か用？
"Beatrix, I gotta say.\! You're different.\! No more talk of ruling existence and building mile-high statues of yourself.",ベアトリクス、言わなければいけないことがある。\!お前は変わった。\!世を支配したり、自分の巨像を建てたりすることについて、話さなくなった。
"Hmmm, I suppose the idea became boring.\! I have moved on to... more immediate pursuits.",ああー、そういうのはなんだか興味なくなっちゃったわ。\!なんというか...世にはもっと差し迫った問題があるでしょ。
Mind if I ask...\| Pendergast seemed a bit old to be your father.,少し聞きたい...\|ペンダーガストはお前の父親にしては年配すぎると思うのだが？
"Well well, flattery will get you everywhere!\! If you must know, the old man adopted me.\! I always did have everything money could buy, save for true love and affection, of course!\! I've known for some time he simply wanted my divine gift.\! He would be pleased if I were to kill you now, and seek ultimate power for myself.\! But I can't let him have his way, hmm?\! Guess we found our answer, darling.\! No more power hungry Beatrix, because she doesn't want to be her father.",あらあら、いいところに気がついたわね！\!本当のことを言うとね、あの人に養子にされたのよ。\!私はね、お金で買えるものはなんでも持っていたわ！ただし、本物の愛を除いてね。\!しばらくして気づいたんだけど、あの人は単に私の神の力を欲していたのよ。\!私が今あなたを殺して、究極の力を求め始めたら、あの人きっと喜ぶでしょうね。\!でも、そんなことはしないから安心して。\!もう私たちみんな、答えを出したでしょ。\!このベアトリクスは力の追求をやめたのよ。父親のようになりたくないからね。
Makes sense.,なるほど。
"Oh, darling, one last thing.\! Have you thought about how you will be executing Lysander?\! May I suggest letting me use him for meteor target practice?",ああ、あと1つだけ。ライサンダーの処刑方法はもう決めたの？\!隕石魔法の練習に使うとか、いいんじゃないかと思うんだけど？
"Uhhh... no.\! I'm still thinking about it.\! You joke about it, but... just give me some time.",うーん...却下だな。\!それについては、未だに考えているところだ...。\!とまあ、そうやって冗談を言うのは結構だが、人に誤解されかねない言動はもう少し慎んでくれ。
...Joke??,...冗談？こっちは全然本気なんだけどねえ。
