ENGLISH,JAPANESE
"Hello, Jaromir. I'm glad you came to see me off.\| Still sticking to your plan?",ジャロミール。旅立ちの前に迎えに来てくれてありがとう。\|今後は当初の計画通りにするのか？
"...\| Yes.\| I must, Avatar of Donar.",...\|ああ、\|ドナーの化身よ。
"What the...\| call me \n[8], will ya?!",うう...\|\n[8]と呼んでくれないか！？
"Of course, \n[8].",うむ、\n[8]。
"I hear you, there's a lot of work to be done. You're going to be integral to the rebuilding process in Veridia.",もちろん、まだまだやるべきことは山積みだ。そしてあなたはきっと、ベリディアの再建に欠かせない存在となるだろう。
"It is not just that, \n[8].\| Since you appeared in our world, my holy covenant has not changed.\! The demonic cult brought undue burden to our homeland. These scars will not heal for some time.\! Adventuring off to the unexplored continent... that is a young one's game.\| But I can still be effective here... as a purveyor of Donar's goodness and glory.\! That some day, we will not need holy wars. Only an unshakeable faith in the true nature of all things to unify this world.",それだけではない、\n[8]。\|あなたが我々の世界に現れて以来、我が聖なる協定は変わっていない。\!悪のカルトは、我が国に大いなる災厄をもたらした。この傷がしばらく癒えることはないだろう。\!未踏の大陸への冒険...それは若者がすべきことだ。\|だが、私はここで使命を果たすことができる...ドナーの善と光の実行者として。\!そしていつの日か、我々は戦争を必要としなくなる時が来る。真理に対する揺らぎなき信仰が、世界を1つにまとめあげるのだ。
That's...\| that's a lot to put on your shoulders.,それは...\|随分と大きな責任を背負ったものだな。
"It is my reason to live.\| I live to be among Donar's greatest soldiers.\! And to protect the legacy of his Avatar, when she is finally ready to return to us.",それが私の生の目的なのだ。\|私は今、ドナーの最高の戦士たちと共にいる。\!そして、ドナーの化身がここに戻ってきた時のために、その遺産を保護するのだ。
"And return I will, Jaromir.\| Thank you for being by my side for this journey.\| I will see you again... but rest assured, Donar will be your partner in crime until then.",私は必ず戻ってくるよ、ジャロミール。\|...ここまでの旅路を一緒に来てくれて、ありがとう。\|またいつか会おう...でも、安心しておくれ。その時までは、ドナーがあなたの傍にいる。
