ENGLISH,JAPANESE
Legends 1A: Promise of Peace,伝説1A:平和の約束
As expected. Lord Godfrey was never going to let this happen peacefully.,どうやらゴドフリー卿も、簡単には道を通してくれんようだな。
"I must reach the capital, here. Be on guard, we can surely expect even more resistance than what we see now.\! Pray we do not face his elite Arbalest units again, they have proven quite deadly.",これより都に向かうが、今までよりもさらに厳しい戦いになるだろう。\!できれば、やつのアルバレストの精鋭部隊とはやりあいたくないものだ...あまりにも危険すぎるからな。
"Florina, I dread the idea of a bringing child to this battlefield. But you must know that these men are coming for you.\! You must stay near me, but stay safe. Just until we make it to Armitage in one piece.",フロリーナ様、幼きあなたを悲惨な戦場に連れ出すなど、本当におぞましいことだ。しかし、あの男たちは現に、あなたの身を狙っているのです。\!アーミテージにたどり着くまでは、くれぐれも私の傍を離れないように。
"I will stay near! I trust you, Captain Antares!",ええ、もちろんよ！絶対に離れないわ、アンタレス隊長！
Thank you. Donar watch over us.,...よろしい。では、行きましょう。我らにドナーの加護があらんことを！
"How absurd! This is the great hope for all Veridia? This small child?!\! What has she done to earn Donar's favor? What could she do?!\! Captain Antares, a true lapdog, to the very end. Arbalests, destroy him!",なんと馬鹿馬鹿しい！こやつがベリディアの希望だと？\!この小娘に、国家を再建させる力があるとでも言うのか！？\!アンタレス隊長、ここがお前の運の尽きだな。アルバレスト部隊よ、この者どもを木っ端微塵に粉砕せよ！
