ENGLISH,JAPANESE
Narima is very confident in the Sayunaa strategy. Claims that her people wish for outside intervention.\! What do you think? Are we doing the right thing here?,ナリマはサユナーの戦略分析にかなり自信を持っているようです。曰く、民は外部からの介入を望んでいると。\!そこについて、あなたはどう思いますか？我々は正しい方向に進んでいると思いますか？
"To be frank, no.",正直なところ、そうは思わないな。
"Alright, then.",そうですか...
"That doesn't mean it's not strategically sound.\! Indeed, it may be the only way to pull the Sayunaari away from the Imperial yoke.\! Morally, I find it an alarming shift from your former attitude toward this war.\! Perhaps, then, it is better that you are our leader, and I simply the vizier.",別に、ナリマの考えが間違っているという話ではない。\!確かに、それがサユナーを帝国のくびきから離す唯一の方法かもしれない。\!だが、この戦争に対する君の態度の急変には危険を感じている。\!おそらく、君が指導者として、そして私が補佐役に徹した方が良いだろう。
"I see...\| you baffle me sometimes.\! On one hand, when I vow to have the cultists utterly destroyed, I see only your approval.\! But now...",なるほど...\|あなたには、時々困惑させられますね。\!カルトを倒すことに関しては、いつでも全面的に賛成してくれる。\!でも今は...
"I just pray that the Sayunaari do not have to suffer, by our hand or by Casamir's.\! Their history is plagued with suffering.",私はただ、カサミールの手によってサユナー人が苦しまないようにと、そう願っているだけだ。\!あの国は今、ひどく病んでいる。
Then I hope they choose wisely.,なら、彼らにも前向きな判断を期待したいものですね。
